Guinea-Bissau,GW,2021,2172,258,43,17,0,0,15,,2473,2490,32,2505,2172,32,0,0,1,221,19,,,30,,,,260,435,396,225,94,82,1492,0,9,,,38,,,,167,266,229,121,63,56,902,0,96,60,1951,,,1,,45,0,0,44,1,0,1,2,1,1,1,1,44,1,,1934,17,33,11,,,0,0,0,0,0,0,0,0,0,0,0,0,0,0,0,0,0,0,0,1,,1,2103,620,464,0,,,,1,,,,Reporting dates were not provided.,,,,,Reporting dates were not provided.,,,,,,,Reporting dates were not provided.,,,,,,,2022-08-26,0,,,,,,,,,1,,,,,,
Guyana,GY,2021,267,73,34,28,12,0,47,,374,414,87,461,267,62,0,11,1,220,1,1,2,,,14,22,,56,58,66,44,27,287,0,2,1,1,,,8,9,,29,20,26,12,15,119,0,8,60,268,,,0,,,,6,6,0,,0,,0,,0,,12,1,,237,57,3,3,,,0,0,0,0,0,0,0,0,0,0,0,0,0,0,0,0,0,0,0,0,No testing is currently being done for 2nd line TB medication,1,341,65,53,1,7,1,1,0,Updated coverage results shared with NAPS to update the GAM report.,,,Reporting dates were not provided.,,,,,Reporting dates were not provided.,,,,,,,Reporting dates were not provided.,,,,,,,2022-08-26,0,,,,,,,,,0,,,,,,
"China, Hong Kong SAR",HK,2021,2301,422,755,147,49,37,24,,3478,3711,257,3735,2300,171,1,410,1,220,2,0,6,,,32,42,,111,134,243,508,1235,2305,0,2,1,9,,,15,50,,194,245,210,220,452,1386,0,20,0,,,,0,,28,3,0,27,0,3,1,26,1,25,1,2,30,0,"2.23 The number was the total intended ""all oral"" regimen but some patients were given an interim course of injectable to tide over the period of side-effects.

2.26 Two cases were started on all oral shorter regimen but they all had drug intolerance and were then changed to all oral longer regimen after 2 days.",2181,156,22,6,,,2180,156,113,10,21,6,17,4,27,3,0,0,0,0,3,0,0,0,0,0,,1,2940,30,27,,,,,0,,,,Reporting dates were not provided.,,,,,Reporting dates were not provided.,,,,,,,Reporting dates were not provided.,,,,,,,2022-08-26,0,,,,,,,,,0,,,,,,
Honduras,HN,2021,1628,153,163,100,11,8,29,,1944,2063,148,2092,1628,119,0,0,1,220,13,5,9,,,50,165,,294,220,194,160,193,1276,0,7,8,6,,,43,91,,144,106,112,110,133,739,0,48,60,1004,,,0,,16,0,0,12,0,0,1,12,1,12,0,,12,0,Los pacientes que iniciaron tratamiento solamente fueron 12  ya que 2 fallecieron y 2 rehusaron ,690,80,9,7,,,689,80,4,1,9,7,1,1,0,0,0,0,0,0,0,0,0,0,0,0,,1,2030,116,86,1,47,1,1,0,,,,Reporting dates were not provided.,,,,,Reporting dates were not provided.,,,,,,,Reporting dates were not provided.,,,,,,,2022-08-26,0,,,,,,,,,0,,,,,,
Croatia,HR,2021,,,,,,,,,,,,,,,,,,,,,,,,,,,,,,,,,,,,,,,,,,,,,,,,,,,,,,,,,,,,,,,,,,,,,,,,,,,,,,,,,,,,,,,,,,,,,,,,,,,,,,,,,,,,,,Reporting dates were not provided.,,,,,Reporting dates were not provided.,,,,,,,Reporting dates were not provided.,,,,,,,2022-08-26,,,,,,,,,,,,,,,,
Haiti,HT,2021,7108,1672,893,495,195,44,258,,9673,10407,992,10665,7100,724,8,0,1,220,268,99,110,,,578,585,,1840,1109,669,404,303,5488,,232,104,111,,,510,515,,1149,796,469,307,249,3995,,924,60,2380,,,1,,73,0,0,66,0,0,1,66,1,66,0,,66,0,,714,104,35,38,,,264,38,48,24,35,25,29,23,19,0,,,,,,,,,,1,Les antibiogrammes pour la Bédaquiline et la linézolide ne sont pas encore réalisés.,1,9768,1414,1303,1,788,83,74,0,,1145,0,,"Il s'agit des PVVIH qui recoivent le traitement TB au cours de la période de référence. En attendant la phase de validation de données de l'Equipe M&E de la Coordination du PNLT, les désagrégations seront disponibles.
",754,14598,0,,,12660,14598,,,0,,,,,1,,,2022-08-26,0,,,,,,,,,0,,,,,,
Hungary,HU,2021,164,112,13,9,12,0,21,4,289,310,42,331,164,25,0,27,1,220,3,0,0,,,3,5,,31,23,45,53,49,209,0,0,1,0,,,2,3,,13,14,15,20,30,97,0,4,60,0,,,,Data extracted from ECDC/TESSy 2022-08-26,5,6,0,4,0,6,,,,,,,,,{2.14-2-20: Data extracted from ECDC/TESSy 2022-08-26}. ,139,23,6,5,,,138,23,15,6,6,5,5,5,10,6,0,0,0,0,0,0,0,0,6,1,Data extracted from ECDC/TESSy 2022-08-26,,,,,,,,,,,,,Reporting dates were not provided.,,,,,Reporting dates were not provided.,,,,,,,Reporting dates were not provided.,,,,,,,2022-08-26,0,,,,,,,,,0,,,,,,
Indonesia,ID,2021,213685,170823,35353,8663,3553,500,10658,,419861,432577,23374,443235,199187,16370,14498,28,1,220,12690,5475,3659,,,12048,21803,,40688,42218,45947,40103,24435,227242,,10883,4618,4643,,,15777,22237,,32814,28972,30237,22506,10824,163367,,41968,60,214160,,,1,,7876,392,0,4817,42,417,1,4886,1,2682,1,1989,2872,0,"2.20 including patients diagnosed in 2020, but started treatment in 2021.

2.27 Data generated from electronic TB information systems with high probability of under-reporting. Core aDSM is mandatory based on National TB guideline for all DRTB patients starting treatment.",144511,15437,4014,3814,8126,1772,1471,1685,812,1225,1471,1685,812,1225,3780,385,3,23,0,7,109,13,2,1,227,1,,1,209157,8015,3242,1,11536,232,73,0,"The number of TB/HIV patients on ART in 2021 is different from report by the National AIDS Program to UNAIDS due to different submission time. The National AIDS Program to UNAIDS was submitted in April 2022 and used data from SITB by 2 March 2022. Meanwhile, Global TB Reported will be submitted on 18 May 2022 and using data by 28 April 2022. ",3211,0,,,2326,42966,0,,,1985,42966,,,0,,,,,1,,,2022-08-26,0,,,,,,,,,0,,,,,,
Ireland,IE,2021,115,39,56,,,,7,1,210,210,7,217,50,5,65,122,1,220,0,0,1,,,5,4,,39,23,24,16,20,131,0,0,0,0,,,2,5,,27,16,9,9,9,77,0,1,60,91,,,,Data extracted from ECDC/TESSy 2022-08-26,7,1,0,2,0,1,1,1,1,1,3,,3,0,{2.14-2-20: Data extracted from ECDC/TESSy 2022-08-26}. ,40,4,0,2,,,39,4,1,1,0,2,0,1,0,0,0,0,0,0,0,0,0,0,0,1,Data extracted from ECDC/TESSy 2022-08-26,1,64,1,1,,,,,0,Please take the above 2.44 and 2.45 from TESSy,,,Reporting dates were not provided.,,,,,Reporting dates were not provided.,,,,,,,Reporting dates were not provided.,,,,,,,2022-08-26,0,,,,,,,,,0,,,,,1,Data not available till June 2022.
Israel,IL,2021,103,30,76,1,3,0,0,0,209,213,4,213,103,1,0,171,1,220,6,1,0,,,1,2,,32,4,21,13,21,94,0,1,1,1,,,1,3,,14,17,11,8,25,79,0,10,0,,,,1,"Despite the fact that Xpert is available in Israel, our routine surveillance include only Culture & DST",6,12,0,6,0,12,1,10,3,,3,,12,0,,103,1,9,0,,,103,1,17,0,9,0,9,0,9,5,0,0,0,0,0,0,0,0,5,0,,1,213,16,16,,,,,0,,,1,,,,,1,,,,,,,1,,,,,1,,,2022-08-26,0,,,,,,,,,0,,,,13,1,
India,IN,2021,882353,502320,478296,91884,6760,3831,151532,,1862969,1965444,254007,2116976,882353,176634,0,,1,220,17795,14410,22326,,,82849,119114,,205797,195011,206301,181671,138221,1128964,0,10784,11063,38203,,,107185,126747,,174319,104745,87993,70301,50609,721899,0,114581,60,432398,,,1,2.6 - this data is not available in the national database ,47902,10935,145,43112,3535,9780,1,16752,1,23889,1,1939,52892,1,"All MDR-TB, Pre-XDR-TB, XDR-TB patients are actively and systematically subjected to clinical and laboratory assessment at the time of treatment initiation and while managing toxicities. Before November 2021, aDSM were documented locally at DR-TB centre level. Since November 2021, an aDSM electronic reporting module developed and released in Nikshay.",673008,128236,31847,22352,65789,20227,175057,46325,19067,14311,12986,10497,9417,7872,19752,10307,3,7,117,6,130,1786,3,7,8248,0,,1,1868972,34339,31935,1,104981,669,622,0,,,0,Record removed by UNAIDS,"NACP Programme data and National TB Elimination Programme Data
",,,1,,,,,,,,Reporting dates were not provided.,,279966,357892,0,,"National AIDS Control Programme data
",2022-08-26,0,,,,,,,,,0,,,,,,
Iraq,IQ,2021,2074,930,2530,129,59,79,31,,5534,5801,298,5832,2074,149,0,0,1,221,82,,,132,,,,460,637,662,481,289,336,2865,0,55,,,169,,,,637,436,364,365,332,364,2498,0,438,0,,,,1,,100,10,10,100,2,10,1,78,1,76,1,2,78,0,,618,149,43,57,,,618,149,32,54,43,57,27,50,100,1,,,,,,,,,,1,,0,5339,2,2,,,,,0,,,,Reporting dates were not provided.,,,,,Reporting dates were not provided.,,,,,,,Reporting dates were not provided.,,,,,,,2022-08-26,0,,,,,,,,,1,,,,,,
Iran (Islamic Republic of),IR,2021,3909,593,1380,212,63,42,116,,5882,6199,433,6315,3909,324,0,1253,1,220,41,25,26,,,100,230,,522,575,489,487,894,3297,0,36,26,54,,,109,154,,340,309,312,483,987,2694,0,208,0,,,,0,,39,1,0,34,0,0,1,25,1,34,0,,34,0,,1828,263,19,20,,,1360,235,30,44,19,20,6,14,18,1,0,0,0,0,0,0,0,0,1,0,,1,5650,120,110,,,,,0,,110,0,,,49,977,0,,,51,977,233,15815,0,,,172,201,0,,,2022-08-26,0,,,,,,,,,0,,,,,,
Iceland,IS,2021,,,,,,,,,,,,,,,,,,,,,,,,,,,,,,,,,,,,,,,,,,,,,,,,,,,,,,,,,,,,,,,,,,,,,,,,,,,,,,,,,,,,,,,,,,,,,,,,,,,,,,,,,,,,,,Reporting dates were not provided.,,,,,Reporting dates were not provided.,,,,,,,Reporting dates were not provided.,,,,,,,2022-08-26,,,,,,,,,,,,,,,,
Italy,IT,2021,,,,,,,,,,,,,,,,,,,,,,,,,,,,,,,,,,,,,,,,,,,,,,,,,,,,,,,,,,,,,,,,,,,,,,,,,,,,,,,,,,,,,,,,,,,,,,,,,,,,,,,,,,,,,,Reporting dates were not provided.,,,,,Reporting dates were not provided.,,,,,,,Reporting dates were not provided.,,,,,,,2022-08-26,,,,,,,,,,,,,,,,
Jamaica,JM,2021,44,9,4,0,0,0,0,,57,57,0,57,44,0,0,0,1,221,0,,,1,,,,1,11,5,7,6,6,36,0,1,,,1,,,,4,3,0,4,5,2,18,0,3,60,14,,,0,,0,0,0,0,0,0,0,,0,,0,,0,0,,44,,0,,,,0,0,0,0,0,0,0,0,0,0,0,0,0,0,0,0,0,0,0,0,,1,51,8,8,1,0,0,0,0,,9,0,,,1,1340,0,,,,,,,1,,,,,1,,,2022-08-26,0,,,,,,,,,0,,,,,,
Jordan,JO,2021,79,24,114,2,0,0,6,,217,219,8,225,79,8,0,25,1,222,,,,,5,,,13,24,17,12,13,8,87,,,,,,7,,,33,37,20,12,12,6,120,,12,60,64,,,1,,4,0,0,2,1,0,1,1,1,1,1,1,2,0,,62,2,1,0,,,62,2,4,0,1,0,1,0,1,0,,,,,,,,,,0,,0,214,0,0,,,,,0,,,,Reporting dates were not provided.,,,,,Reporting dates were not provided.,,,,,,,Reporting dates were not provided.,,,,,,,2022-08-26,0,,,,,,,,,0,,,,,,
Japan,JP,2021,7072,999,2988,278,64,118,,,11059,11519,460,11519,6982,278,90,1313,1,220,5,4,3,,,48,235,,414,274,488,603,4652,6714,0,9,1,7,,,50,212,,384,282,325,243,3280,4776,0,29,0,,,,1,,,,,,,,1,40,1,,0,,40,1,2.27: 40 or more. All cases that includes either Bedaquiline or Delamanid are actively monitored. 38 cases started Delamanid and mostly treated with both Bedaquiline and Delamanid.,4343,166,48,7,,,4335,166,205,11,48,7,36,4,,,,,,,,,,,,1,,1,847,30,,,,,,1,,,,Reporting dates were not provided.,,,,,Reporting dates were not provided.,,,,,,,Reporting dates were not provided.,,,,,,,2022-08-26,0,,,,,,,,,0,,,,,,
Kenya,KE,2021,39351,22629,9606,2648,1525,251,1844,,71586,76010,6268,77854,39335,3780,16,0,1,220,2435,666,785,,,2526,4621,,12259,11947,7493,3881,3373,46100,0,2177,538,825,,,2129,2990,,5939,4805,2935,1768,1918,22484,0,7426,60,49233,,,0,,465,5,16,465,16,5,1,363,1,465,1,0,465,0,,24832,2773,271,117,,,236,198,163,155,61,67,19,35,32,2,,,,,,,,,,1,,1,73830,17635,16996,1,7072,844,802,0,,,0,Record removed by UNAIDS,,,,0,Record removed by UNAIDS,,34389,108848,,,0,,"Indicator ""Total number of people currently enrolled on antiretroviral therapy who have started tuberculosis preventive treatment prior to the reporting period""  the data reported is reflective of 2014-2021 reporting period. However, the Countiry's reporting on IPT/TPT based on the National Health information system has not been optimal.
Newly enrolled on antiretroviral therapy: Age disaggreagtions as provided not available for this indicator.
",,,0,Record removed by UNAIDS,,2022-08-26,0,,,,,,,,,0,,,,,,
Kyrgyzstan,KG,2021,2055,904,942,326,308,61,613,178,3901,4596,1308,5209,2055,707,0,0,1,221,36,,,82,,,,450,504,404,417,419,328,2522,0,32,,,89,,,,395,437,252,197,239,315,1835,0,239,60,2080,,,1,,788,129,70,756,61,116,1,918,1,656,1,146,940,0,,1932,669,500,339,309,132,1570,534,647,341,500,339,402,283,665,116,3,1,0,9,103,0,0,0,0,0,,1,4394,126,77,,,,,0,"В пункте 2.46: Число пациентов с ТБ/ВИЧ ко-инфекцией, находящихся на АРТ терапии в 2021 году [77] не совпадает с количеством случаев, зарегистрированных программой по борьбе с ВИЧ/СПИД [139], т.к. ВИЧ-служба регистрирует всех пациентов, включая случаи активного ТБ и неактивного ТБ (с",139,0,,,73,856,0,,,274,856,562,5044,0,,,624,705,0,,,2022-08-26,0,,,,,,,,,1,,,,226,1,
Cambodia,KH,2021,7551,4999,8855,92,74,18,72,,21405,21589,256,21661,7549,112,2,,,221,916,,,2036,,,,630,1078,1653,1896,2352,2012,9621,,552,,,1521,,,,610,966,983,1076,1569,1739,6943,,5025,,,,,1,,65,7,65,65,0,7,1,61,1,23,1,37,72,1,,,,,,,,,,,,,,,,72,7,,,,,,,,,,1,,1,17286,296,275,,,,,0,,275,0,,,113,3223,0,,,1119,3223,5489,62561,0,,,,,0,Record removed by UNAIDS,,2022-08-26,0,,,,,,,,,0,,,,,,
Kiribati,KI,2021,183,44,91,10,0,2,11,,318,330,23,341,183,21,0,1,1,221,11,,,16,,,,30,24,22,31,29,7,143,0,5,,,14,,,,38,27,19,18,25,14,141,0,46,60,224,,,0,,1,0,0,0,0,0,0,,0,,0,,0,0,A child was diagnosed with Pulmonary TB with laboratory-confirmed rifampicin resistance on the 31/12/21. The child was report and registered in 2022 registry and started treatment later in 2022 hence will be reported for 2022,177,12,0,0,,,0,0,0,0,0,0,0,0,0,0,0,0,0,0,0,0,0,0,0,0,,1,219,0,0,,,,,0,,,,Reporting dates were not provided.,,,,,Reporting dates were not provided.,,,,,,,Reporting dates were not provided.,,,,,,,2022-08-26,0,,,,,,,,,0,,,,,,
Comoros,KM,2021,68,21,44,1,0,0,1,,133,134,2,135,68,1,0,0,1,221,7,,,4,,,,11,19,14,9,8,14,75,0,1,,,4,,,,9,9,7,7,2,9,43,0,16,60,90,,,0,,0,0,0,0,0,0,0,,0,,0,,0,0,,68,1,0,0,,,0,0,0,0,0,0,0,0,0,0,0,0,0,0,0,0,0,0,0,0,,0,126,3,2,,,,,0,,2,0,,,2,5,0,,,,,,,1,,,,,1,,,2022-08-26,0,,,,,,,,,0,,,,,,
Saint Kitts and Nevis,KN,2021,0,0,0,0,0,0,0,,0,0,0,0,0,0,0,0,,,,,,,,,,,,,,,,,,,,,,,,,,,,,,,,,,5,,,,1,,0,0,0,0,0,0,0,,0,,0,,0,1,no patients identified 2021,0,0,0,0,,,0,0,0,0,0,0,0,0,0,0,0,0,0,0,0,0,0,0,0,1,,1,0,0,0,1,0,0,0,1,,,1,,"No co-infection
",,,1,,"No Cases
",,,,,1,,"No cases
",,,1,,"No Case
",2022-08-26,0,,,,,,,,,0,,,,,,
Democratic People's Republic of Korea,KP,2021,26269,36645,17539,6960,0,0,6184,,80453,87413,13144,93597,26269,13144,0,0,1,221,416,,,2237,,,,5393,9539,13319,14223,7518,2422,52414,0,316,,,1481,,,,3727,5938,8068,7481,3901,1434,30549,0,4450,0,,,,1,,270,0,0,815,0,0,1,815,1,712,1,103,815,1,,0,477,0,270,0,0,,,,,,,,,0,0,,,,,,,,,,1,,0,0,0,0,,,,,1,,,,Reporting dates were not provided.,,,,,Reporting dates were not provided.,,,,,,,Reporting dates were not provided.,,,,,,,2022-08-26,0,,,,,,,,,1,,,,,,
Republic of Korea,KR,2021,11530,2865,4293,1733,542,470,1471,,18688,21433,4216,22904,11314,2320,216,1242,1,220,3,3,14,,,90,240,,782,950,1888,2860,6065,12875,0,2,3,12,,,72,219,,684,702,901,1055,4888,8521,0,37,60,11035,,,0,,603,51,0,603,0,51,1,468,1,603,3,,,1,"2.21
Used drug after pre-examination and conditional approval.(2021.1.1.~12.31.)
(Exclusion condition of use of new drugs before January 1st and use of the same drug for more than 24 weeks.)

2.25-2.26
When a patient whose treatment regimen changed to a shorter MDR-TB regimen,
reporting on a change of a treatment regimen is not mandatory.

2.27
When patients who started treatment for MDR-TB, pre-XDR-TB or XDR-TB had adverse events, reporting on side effects is not mandatory.",9284,1661,279,211,,,9284,1661,318,188,279,211,183,162,490,42,0,0,0,1,41,0,0,0,0,1,,0,,,,,,,,1,"2.43-2.46
According to Privacy protection act, TB & HIV registries cannot be merged",,,Reporting dates were not provided.,,,,,Reporting dates were not provided.,,,,,,,Reporting dates were not provided.,,,,,,,2022-08-26,0,,,,,,,,,0,"3.2
According to Privacy Protection Act, TB & HIV registries cannot be merged.",,,,,
Kuwait,KW,2021,401,80,255,,,,,,736,736,,736,401,0,0,306,0,221,0,,,4,,,,22,133,111,101,61,14,442,0,1,,,5,,,,14,109,83,48,18,12,284,0,10,60,656,,,0,,8,1,0,8,0,1,0,,1,8,0,,9,0,,401,,5,,,,395,0,22,0,5,0,5,0,5,1,,,,,,,,,,1,,1,311,2,2,,,,,0,,,,Reporting dates were not provided.,,,,,Reporting dates were not provided.,,,,,,,Reporting dates were not provided.,,,,,,,2022-08-26,0,,,,,,,,,0,,,,,,
Cayman Islands,KY,2021,,,,,,,,,,,,,,,,,,,,,,,,,,,,,,,,,,,,,,,,,,,,,,,,,,,,,,,,,,,,,,,,,,,,,,,,,,,,,,,,,,,,,,,,,,,,,,,,,,,,,,,,,,,,,,Reporting dates were not provided.,,,,,Reporting dates were not provided.,,,,,,,Reporting dates were not provided.,,,,,,,2022-08-26,,,,,,,,,,,,,,,,
Kazakhstan,KZ,2021,5127,1502,437,2190,428,73,251,32,7066,9757,2942,10008,5127,2409,0,156,1,220,41,38,67,,,199,284,,940,1401,1329,1085,631,5869,0,33,36,85,,,267,365,,797,659,447,419,634,3588,0,300,60,9630,,,0,,3294,461,782,3403,93,469,1,4123,1,,1,297,,1,,5121,2401,1932,1011,2177,833,5121,2401,2359,1123,1932,1011,1503,762,2931,461,,,,,,,,,,1,,1,9620,625,581,,,,,0,,581,0,,,111,2063,0,,,1705,2063,2569,22315,0,,,878,1403,0,,,2022-08-26,0,,,,,,,,,0,,,,325,1,
Lao People's Democratic Republic,LA,2021,3796,1635,379,191,114,8,77,,5810,6123,390,6200,3796,239,0,38,1,221,3,,,21,,,,266,552,571,726,867,896,3878,0,5,,,21,,,,159,283,309,405,528,511,2195,0,50,60,5849,,,0,"2.6  Foreign-born individuals among total number of TB cases reported in TB-Tracker.

2.11 new and relapse TB cases initially tested by Xpert available in case-based TB tracker system in the country coverage. ",44,0,0,36,0,0,1,19,0,,1,19,19,0,,3796,239,13,31,,,0,0,0,0,0,0,0,0,29,0,0,0,0,0,0,0,0,0,0,1,,0,5220,301,210,,,,,0,,206,0,,,295,1489,0,,,560,1489,,,0,,,,,1,,,2022-08-26,0,,,,,,,,,0,,,,,,
Lebanon,LB,2021,250,25,191,3,0,2,2,,466,471,7,473,250,3,0,239,1,220,9,9,7,,,13,22,,42,28,24,23,25,177,0,5,5,6,,,13,36,,110,35,24,19,16,253,0,41,60,273,,,0,,2,2,0,2,0,2,1,4,0,,1,2,4,0,,228,3,3,0,,,228,3,5,0,3,0,2,0,3,2,0,0,0,0,1,0,0,0,1,0,,0,342,3,3,,,,,0,,3,0,,,3,166,0,,,2,166,,,0,,,,,1,,,2022-08-26,0,,,,,,,,,0,,,,,,
Saint Lucia,LC,2021,2,2,0,0,0,0,0,,4,4,0,4,2,0,0,0,1,220,0,0,0,,,0,0,,0,0,0,2,1,3,0,0,0,0,,,0,0,,0,0,1,0,0,1,0,0,60,2,,,0,2 cases were diagnosed with the assistance of CT scan results,0,0,0,0,0,0,0,,0,,0,,0,0,There were no documented cases of drug resistant TB in 2021.,2,0,0,0,,,0,0,0,0,0,0,0,0,,,,,,,,,,,,1,"Please note that samples have to be sent to CARPHA for Isoniazid testing. To the best of my knowledge, no samples were sent in 2021.  There were neither RR nor pre-XDR TB clients in 2021.",1,4,0,0,1,0,0,0,0,There were no documented cases of TB in the 0-14 age category.,0,0,,,0,81,0,,,,,,,0,,,,,1,,,2022-08-26,0,,,,,,,,,0,,,,,,
Sri Lanka,LK,2021,3491,936,1836,223,31,34,220,,6263,6551,508,6771,3483,391,8,14,1,221,18,,,68,,,,281,409,682,886,944,837,4039,,23,,,56,,,,331,308,353,425,481,449,2347,,165,60,1563,,,1,"2.11 - Disaggregated results are not available for new and relapse cases separately. Therefore, Gene X pert positives out of total TB cases was taken here. ",10,0,0,9,0,0,1,9,0,,0,,9,0,"Out of the 10 patients diagnosed in 2021, 9 patients were started on treatment in the same year and for the remaining patient treatment started in 2022.",1214,377,13,6,,,0,0,0,0,0,0,0,0,,,,,,,,,,,,1,,0,6579,48,23,,,,,0,Disaggregated HIV data of new and relapse TB patients are currently not available in NPTCCD recording and reporting system. Therefore  all TB patients have been considered in filling the above. ,,1,,,29,330,0,,,128,330,,,0,,,,,1,,,2022-08-26,0,,,,,,,,,1,,,,,,
Liberia,LR,2021,4002,1209,1999,78,22,17,114,,7210,7327,231,7441,3999,150,3,,1,221,374,,,263,,,,647,924,891,657,366,245,3730,0,296,,,213,,,,462,531,565,436,302,182,2478,1,1146,60,1501,,,1,"The NTP has not conducted verification and validation of the data being submitted, therefore the comments generated by the system are noted and will be corrected once the validation process is concluded.",100,0,0,90,1,0,1,,1,1,1,89,,1,Three patients are presumed to have pre-XDR-TB,1486,57,68,21,,,,,,,,,,,,,,,,,,,,,,1,The laboratory capacity for conducting clinical monitoring of patients and conducting TB culture and DST for patients is not functional in the country. The TB culture and DST lab have been under renovation since 2018.,1,6762,775,705,0,,,,1,,705,0,,,609,6313,0,,,1862,6313,3896,21302,0,,,,,1,,,2022-08-26,0,,,,,,,,,1,,,,,,
Lesotho,LS,2021,2494,1036,333,379,192,56,63,,3863,4490,690,4553,2494,418,0,,,220,63,32,18,,,48,123,,516,632,539,377,591,2826,0,53,31,34,,,59,105,,334,364,255,111,205,1433,0,231,60,3807,,,1,,110,5,2,110,2,5,1,8,1,28,1,84,117,0,,2279,346,53,21,,,53,22,0,1,53,21,0,0,67,5,,,,,,,,,,1,,1,4352,2397,2207,1,199,45,40,0,,2250,0,,,,,1,,,,,,,0,,,,,0,Record removed by UNAIDS,,2022-08-26,0,,,,,,,,,0,,,,,,
Lithuania,LT,2021,465,33,52,78,0,0,18,0,550,628,96,646,465,96,0,7,1,220,1,2,3,,,4,7,,46,85,134,98,60,434,0,2,1,4,,,2,10,,27,34,32,30,46,181,0,13,60,0,,,,Data extracted from ECDC/TESSy 2022-08-26,84,21,0,25,0,21,1,46,1,,1,,46,1,"{2.14-2-20: Data extracted from ECDC/TESSy 2022-08-26}. 
2.22. Data are preliminary",465,96,73,32,,,465,96,121,39,73,32,68,30,46,21,0,0,14,0,0,3,0,0,4,1,Data extracted from ECDC/TESSy 2022-08-26,1,594,15,,,,,,1,,,,Reporting dates were not provided.,,,,,Reporting dates were not provided.,,,,,,,Reporting dates were not provided.,,,,,,,2022-08-26,0,,,,,,,,,0,,47746,715,65,0,
Luxembourg,LU,2021,26,2,6,0,0,0,1,0,34,34,1,35,22,1,4,33,1,220,0,0,0,,,2,4,,1,6,3,4,2,22,0,0,0,0,,,0,1,,6,2,1,2,0,12,0,0,60,0,,,,Data extracted from ECDC/TESSy 2022-08-26,0,0,0,0,0,0,,,,,,,,,{2.14-2-20: Data extracted from ECDC/TESSy 2022-08-26}. ,21,1,0,0,,,21,1,2,0,0,0,0,0,0,0,0,0,0,0,0,0,0,0,0,1,Data extracted from ECDC/TESSy 2022-08-26,0,25,0,0,,,,,0,,,,Reporting dates were not provided.,,,,,Reporting dates were not provided.,,,,,,,Reporting dates were not provided.,,,,,,,2022-08-26,0,,,,,,,,,0,,0,0,0,0,
Latvia,LV,2021,196,21,15,20,3,0,6,0,232,255,29,261,192,26,4,6,1,220,0,2,0,,,1,4,,19,52,54,45,16,191,0,0,2,1,,,0,3,,14,11,10,6,15,59,0,5,60,203,,,,Data extracted from ECDC/TESSy 2022-08-26,16,3,0,8,0,2,,,,,,,,0,{2.14-2-20: Data extracted from ECDC/TESSy 2022-08-26}. ,160,24,14,5,,,158,24,42,9,12,5,12,5,12,3,0,0,0,0,2,1,0,0,0,1,Data extracted from ECDC/TESSy 2022-08-26,,,,,,,,,,,,,Reporting dates were not provided.,,,,,Reporting dates were not provided.,,,,,,,Reporting dates were not provided.,,,,,,,2022-08-26,,,,,,,,,,,,,,,,
Libya,LY,2021,803,293,836,12,0,0,43,,1932,1944,55,1987,803,28,0,339,0,221,8,,,51,,,,422,361,183,127,80,66,1239,0,7,,,43,,,,178,109,103,81,56,57,584,0,109,60,1800,,,0,,8,0,0,7,1,0,1,6,1,1,1,5,1,0,"Total number of RR/MDR-TB Cases at 2021 =7cases + one case diagnosed on 2020 and started treatment on 2021 
  ( note one case on high dose of first line regiment)
",540,22,5,2,,,2,2,1,1,2,2,1,1,2,0,0,0,0,0,0,0,0,0,0,0,,1,,11,,,,,,1,,8,0,,,,,1,,,,,,,1,,,,,1,,,2022-08-26,0,,,,,,,,,0,,,,,,
Morocco,MA,2021,13411,1050,13401,999,58,408,801,,27862,29327,2266,30128,13405,1666,6,,1,221,241,,,767,,,,3554,4504,2909,2009,1792,1597,16365,,240,,,945,,,,2721,2497,1754,1337,1214,1246,10769,,2193,60,10656,,,1,2.6 Le nombre de cas tuberculeux des personnes n'est à l'étranger parmi le nombre total des tuberculeux n'est pas disponible pour l'année 2021.,227,35,34,227,2,35,1,154,1,101,1,34,,1,2.27 La généralisation de la procédure n'est pas encore mise en place par le PNLAT.,8129,1666,114,148,,,118,176,90,151,113,148,85,123,262,35,,,,,,,,,,1,"2.28 ii; tous  les cas ayant eu un traitement antérieur ont fait l objet de tests xpert MTB Rif Ulta
La Bédaquiline ne fait pas partie des molécules actuellement testés dans le cadre du PNLAT. Le dispositif permettant de réaliser ce type de test est en cours d'acquisition",1,11732,183,183,,,,,0,,183,0,,,84,1598,0,,,153,1598,,,0,,,,,1,,,2022-08-26,0,,,,,,,,,0,,,,,,
Monaco,MC,2021,0,0,0,0,0,0,0,0,0,0,0,0,0,0,0,0,1,,,,,,,,,,,,,,,,,,,,,,,,,,,,,,,,,5,,,,1,,0,0,0,0,0,0,0,,0,,0,,0,1,Hazim Timimi (WHO/Geneva) changed 2.21 from no response to 'No' on 2022-06-19 because there have not been any patients with MDR/XDR-TB in recent years. ,0,0,0,0,,,0,0,0,0,0,0,0,0,0,0,0,0,0,0,0,0,0,0,0,0,,0,0,0,0,,,,,0,,,1,,,,,1,,,,,,,1,,,,,1,,,2022-08-26,0,,,,,,,,,0,,0,0,0,0,
Republic of Moldova,MD,2021,1028,408,180,348,88,15,181,59,1616,2067,632,2248,1028,529,0,20,1,220,10,16,10,,,17,33,,212,439,407,294,130,1532,0,15,21,17,,,17,19,,102,117,83,51,57,446,0,89,60,1912,,,0,,469,124,80,500,19,124,1,520,1,457,1,123,197,0,,991,512,256,203,272,203,916,382,328,223,256,202,254,200,459,124,11,1,0,12,100,0,0,0,0,0,,1,2008,214,169,,,,,0,,169,0,,,85,804,0,,,263,804,263,7267,0,,,,,1,,,2022-08-26,0,,,,,,,,,0,,45437,45437,199,0,
Montenegro,ME,2021,55,9,9,6,1,0,3,0,73,80,10,83,55,6,0,2,1,221,0,,,0,,,,3,4,6,11,15,6,45,0,0,,,0,,,,2,8,3,6,9,7,35,0,0,60,68,,,1,,0,0,0,0,0,0,0,,0,,0,,,1,,55,6,0,0,,,49,6,1,0,0,0,0,0,0,0,0,0,0,0,0,0,0,0,0,1,,1,80,0,0,,,,,1,,,1,,,,,1,,,,,,,1,,,,,1,,,2022-08-26,0,,,,,,,,,1,,,,3,1,
Madagascar,MG,2021,26163,4502,7579,1316,200,271,1097,,38244,40031,2884,41128,26163,1972,0,0,1,221,673,,,1023,,,,3948,5148,4833,4103,2879,1786,22697,7,611,,,1193,,,,3968,3722,2882,2122,1442,785,14921,3,3500,60,10181,,,0,,94,0,0,75,0,0,0,,0,,0,,75,0,,4142,975,22,72,,,22,72,0,2,22,72,0,2,64,0,0,0,0,0,0,0,0,0,0,0,,1,22750,473,322,,,,,0,,,0,Record removed by UNAIDS,,105,3110,0,,,70,8995,,,0,,,70,70,0,,"
L'initiation au TPI a commencé en dernier trimestre de l'année 2021 et l'outils mise en place pour la collecte de l'information ne nous permet pas de collecter le début ni la fin de la TPI de même la chronologie par rapport au traitement ARV",2022-08-26,0,,,,,,,,,0,,,,,,
Marshall Islands,MH,2021,31,51,31,1,2,2,1,,113,118,6,119,31,1,0,4,1,221,5,,,12,,,,7,5,4,9,9,3,37,0,12,,,3,,,,16,2,9,12,7,3,49,0,32,60,89,,,0,,0,0,0,0,0,0,0,,0,,0,,0,0,,31,1,0,0,,,20,1,0,1,0,0,0,0,0,0,0,0,0,0,0,0,0,0,,0,"there was no mdr, xdr and pre xdr tb detected during 2020",0,114,0,0,,,,,1,there was none among the 2021 patients were tested positive for HIV;,,,Reporting dates were not provided.,,,,,Reporting dates were not provided.,,,,,,,Reporting dates were not provided.,,,,,,,2022-08-26,0,,,,,,,,,0,,,,,,
North Macedonia,MK,2021,100,14,15,8,3,3,3,3,129,143,17,146,100,11,,3,1,221,1,,,0,,,,10,17,14,24,23,15,103,,0,,,2,,,,4,6,10,5,3,12,40,,3,60,112,,,0,,2,0,0,2,0,0,0,,1,1,0,,2,0,,100,11,1,1,,,100,11,2,1,1,1,0,0,0,0,0,0,0,0,0,0,0,0,0,0,,1,29,0,0,,,,,0,The largest part of the medical care was directed to the Covid 19 pandemic and some other medical activities was reduced.,,,Reporting dates were not provided.,,,,,Reporting dates were not provided.,,,,,,,Reporting dates were not provided.,,,,,,,2022-08-26,0,,,,,,,,,0,,,,11,1,
