China,CN,2021,296854,222814,28192,28594,8551,335,8403,,547860,585340,45883,593743,296854,36997,0,423,1,221,217,,,3009,,,,39833,47483,40576,72726,80524,114369,395511,0,150,,,3599,,,,28264,31132,20947,26552,27281,48678,182854,0,6975,60,332535,,,0,,16766,60,0,12803,63,43,1,326,1,12595,1,0,12846,0,,237238,33946,10044,6782,23805,3034,132810,21505,11591,4634,6020,4115,4210,3140,188,60,,,,,,,,,,1,"The resistance  rate of LZD and  BDQ  is currently  less than 1% respectively  in China, and  routine surveillance has not been conducted  yet.",1,407781,5429,4711,0,,,,0,,4488,0,,,1629,127186,0,,,,,,,1,,,,,1,,,2022-08-26,0,,,,,,,,,0,,,,,,
Colombia,CO,2021,8256,2846,2202,240,83,32,432,,13304,13659,787,14091,8000,511,256,879,1,220,88,46,60,,,345,973,,2261,1443,1063,1147,1654,8886,0,77,29,73,,,257,484,,963,644,531,631,890,4400,0,373,60,5284,,,0,,197,8,2,195,7,8,1,195,1,180,1,15,203,0,,3134,289,34,10,,,34,14,14,14,34,5,14,5,7,7,0,0,0,0,0,0,2,5,0,0,,1,12191,1488,847,1,302,7,3,0,"Se genera comentario en relación a que para VIH y TB en ARV se envidencia diferentes fuentes de datos una de ellas cuenta de alto costo que evidencia un subregistro de datos comparado con los que aparecen en el PNT. Adicional los datos reportados por ONUSIDA, diferenten en tiempo de reporte a los que se estan solictando para el informe de TB 2022. ",640,0,,,404,10041,0,,,,,,,0,Record removed by UNAIDS,,,,0,Record removed by UNAIDS,,2022-08-26,0,,,,,,,,,0,,,,,,
Costa Rica,CR,2021,291,4,48,7,0,0,7,,343,350,14,357,291,14,0,81,1,220,5,3,1,,,11,21,,49,34,36,46,27,224,0,1,0,2,,,6,10,,21,20,18,18,21,114,0,12,60,132,,,0,,0,0,0,0,0,0,0,,0,,0,,0,0,No hubo resistencia a Rifampicina para el 2021,122,4,0,0,,,122,4,8,0,0,0,0,0,0,0,0,0,0,0,0,0,0,0,0,0,,1,336,41,,1,12,0,0,1,El punto 2.46 no se tiene el dato,40,0,,,,,1,,,,,,,1,,,,,1,,,2022-08-26,0,,,,,,,,,0,,,,,,
Cuba,CU,2021,329,102,46,26,3,3,11,,477,509,43,520,329,37,0,1,1,220,3,1,1,,,4,12,,66,59,114,71,51,377,,1,1,3,,,9,8,,23,20,18,19,25,122,,10,60,48,,,1,,2,0,,,,,0,,0,,0,,1,1,,133,19,1,1,,,111,14,1,3,1,1,0,0,2,0,,,,,,,,,,1,,1,509,27,27,1,0,0,0,1,,27,0,,,27,1656,0,,,754,1656,754,29689,0,,,,,1,,,2022-08-26,0,,,,,,,,,0,,,,,,
Cabo Verde,CV,2021,142,16,11,10,3,0,3,,169,182,16,185,142,13,0,6,1,221,0,,,0,,,,11,30,45,22,12,9,129,0,0,,,2,,,,13,16,9,6,2,5,51,0,2,60,85,,,0,,1,0,0,1,0,0,0,,1,1,0,,1,0,,98,11,0,1,,,98,11,0,0,0,1,0,0,0,0,0,0,0,0,0,0,0,0,0,0,,0,185,15,15,,,,,0,,,,Reporting dates were not provided.,,,,,Reporting dates were not provided.,,,,,,,Reporting dates were not provided.,,,,,,,2022-08-26,0,,,,,,,,,0,,,,,,
Curaçao,CW,2021,,,,,,,,,,,,,,,,,,,,,,,,,,,,,,,,,,,,,,,,,,,,,,,,,,,,,,,,,,,,,,,,,,,,,,,,,,,,,,,,,,,,,,,,,,,,,,,,,,,,,,,,,,,,,,Reporting dates were not provided.,,,,,Reporting dates were not provided.,,,,,,,Reporting dates were not provided.,,,,,,,2022-08-26,,,,,,,,,,,,,,,,
Cyprus,CY,2021,34,2,10,2,0,0,0,0,46,48,2,48,33,2,1,46,1,220,0,0,0,,,4,3,,7,4,2,3,0,23,0,0,0,0,,,1,3,,11,5,4,1,0,25,0,0,60,21,,,,Data extracted from ECDC/TESSy 2022-08-26,3,0,0,3,0,0,,,,,,,,,{2.14-2-20: Data extracted from ECDC/TESSy 2022-08-26}. ,29,2,3,0,,,29,2,7,0,3,0,3,0,3,0,0,0,0,0,0,0,0,0,0,1,Data extracted from ECDC/TESSy 2022-08-26,,,,,,,,,,,,,Reporting dates were not provided.,,,,,Reporting dates were not provided.,,,,,,,Reporting dates were not provided.,,,,,,,2022-08-26,,,,,,,,,,,,,,,,
Czechia,CZ,2021,267,31,34,16,3,1,5,0,332,352,25,357,267,20,0,132,1,220,4,1,2,,,5,7,,32,42,59,50,53,248,0,3,1,1,,,2,9,,18,15,12,11,25,92,0,12,60,264,,,,Data extracted from ECDC/TESSy 2022-08-26,8,2,0,6,0,2,1,8,1,6,0,,8,0,{2.14-2-20: Data extracted from ECDC/TESSy 2022-08-26}. ,239,15,9,0,,,239,15,20,1,9,0,9,0,7,2,0,0,0,0,2,0,0,0,0,1,Data extracted from ECDC/TESSy 2022-08-26,0,212,7,,,,,,1,,,,Reporting dates were not provided.,,,,,Reporting dates were not provided.,,,,,,,Reporting dates were not provided.,,,,,,,2022-08-26,0,,,,,,,,,0,,139891,3061,34,0,
Germany,DE,2021,2362,252,1064,80,7,27,104,19,3678,3792,218,3896,1720,147,642,2782,1,220,36,11,23,,,116,303,,568,362,316,284,412,2361,2,33,16,34,,,63,144,,309,198,149,127,283,1273,1,153,60,3267,,,,Data extracted from ECDC/TESSy 2022-08-26,85,11,0,48,0,10,,,,,,,,,{2.14-2-20: Data extracted from ECDC/TESSy 2022-08-26}. ,1440,108,54,9,,,1421,106,112,11,53,9,44,8,39,5,0,0,0,0,0,0,1,4,0,1,Data extracted from ECDC/TESSy 2022-08-26,,,,,,,,,1,,,,Reporting dates were not provided.,,,,,Reporting dates were not provided.,,,,,,,Reporting dates were not provided.,,,,,,,2022-08-26,0,,,,,,,,,0,,,,,1,In 2021 112 deaths because of TB were notified.
Djibouti,DJ,2021,789,152,771,87,,,,,1712,1799,87,1799,789,87,0,,0,,,,,,,,,,,,,,,,,,,,,,,,,,,,,,,,,60,,,,0,"2.4: Hazim Timimi (WHO/Geneva) removed the reported value of 1799 on 2022-08-29 as it seemed like a data entry error (no response from NTP despite repeated emails).
2.6 la nationalité n’est pas appliquée dans le pays 2.7; 2.8 et 2.9 pas des données de désagrégation.
 ",,,0,26,0,,0,,0,,0,,,0,pas d’examens de culture fonctionnel,,,,,,,,,,,,,,,,,,,,,,,,,,0,,1,1093,30,15,,,,,0,"2.46LES 15 COINFECTES MIS SOUS ARV SONTLES NOUVEAUX CAS DEPISTER DURANT L ANNEE 2021.
LES 40 RAPPORTES PAR LE PROGRAMME SIDA INCLUS LES ANCIENS CAS.",40,0,,,21,210,0,,,71,208,,,0,,,,,1,,,2022-08-26,0,,,,,,,,,1,,,,,,
Denmark,DK,2021,117,23,51,,,,17,2,191,191,17,208,117,14,0,147,1,220,1,1,1,,,5,5,,24,17,19,19,19,108,0,2,0,1,,,8,3,,12,16,18,9,11,77,0,6,60,183,,,,Data extracted from ECDC/TESSy 2022-08-26,0,1,0,0,0,0,,,,,,,,,{2.14-2-20: Data extracted from ECDC/TESSy 2022-08-26}. ,113,12,1,0,,,113,12,7,0,1,0,1,0,1,1,0,0,0,0,0,0,0,1,0,1,Data extracted from ECDC/TESSy 2022-08-26,,,,,,,,,,,,,Reporting dates were not provided.,,,,,Reporting dates were not provided.,,,,,,,Reporting dates were not provided.,,,,,,,2022-08-26,,,,,,,,,,,,,,,,
Dominica,DM,2021,0,0,0,0,0,0,0,,0,0,0,0,0,0,0,,,,,,,,,,,,,,,,,,,,,,,,,,,,,,,,,,,0,,,,1,Not applicable,0,0,0,0,0,0,0,,0,,0,,0,0,,0,0,0,0,,,0,0,0,0,0,0,0,0,0,0,0,0,0,0,0,0,0,0,0,0,,0,0,0,0,1,0,0,0,0,,,,Reporting dates were not provided.,,,,,Reporting dates were not provided.,,,,,,,Reporting dates were not provided.,,,,,,,2022-08-26,0,,,,,,,,,0,,,,,,
Dominican Republic,DO,2021,1969,767,281,172,121,16,220,,3017,3326,529,3546,1969,309,0,398,1,220,8,8,10,,,55,170,,567,480,359,265,224,2120,0,8,7,14,,,57,123,,265,241,197,135,133,1151,0,55,60,2545,,,0,,175,12,7,177,5,15,1,111,1,183,0,,199,0,,1724,273,125,32,,,354,68,85,21,55,16,47,13,108,11,,,,,,,,,,1,"Parte de la información de 2.36 y 2.37 fue tomada de la base de TB DR, donde los pacientes RR son seguidos en esta base de datos y no tienen la información en el evento del SIOE. ",1,3163,768,672,1,54,10,7,0,,655,0,,,206,5855,0,,,,,,,1,,,,,1,,,2022-08-26,0,,,,,,,,,0,,,,,,
Algeria,DZ,2021,4635,799,13391,187,,,110,,18825,19012,297,19122,4635,297,0,,,222,,,,,46,,,398,717,487,394,285,327,2608,,,,,,79,,,436,356,224,167,194,298,1675,,125,0,,,,1,le nombre de cas dans 2.9 correspond à la répartion des nouveux cas de tuberculose pulmonaire à microscopie positive.,,,,,,,,,,,,,,0,,,,,,,,,,,,,,,,,,,,,,,,,,,0,,0,,,,,,,,1,HIV testing in TB patients is not routinely applied yet. the application of this WHO guideline has been included in the updated version of the national guide which will be published in the second half of this year.,,,Reporting dates were not provided.,,,,,Reporting dates were not provided.,,,,,,,Reporting dates were not provided.,,,,,,,2022-08-26,0,,,,,,,,,1,,,,,,
Ecuador,EC,2021,3982,576,759,278,0,0,378,,5317,5595,656,5973,3982,656,0,67,1,221,46,,,67,,,,840,1178,718,450,424,343,3953,0,52,,,58,,,,302,316,224,188,188,201,1419,0,223,61,,400,400,0,"La información de esta sección solo corresponde a casos de TB sensible. 

Las pruebas de diagnóstico rápido realizadas corresponden a pruebas Xpert MTB/RIF efectuadas en personas privadas de la libertad de la Zona 8 por ser la zona geográfica con más alta carga de la enfermedad",401,18,0,335,12,7,1,77,0,,0,,77,0,"Los casos reportados en esta pagina no estan incluidos en los numerales 2.1 al 2.4, debido a las fuentes de información que no permiten recolectar todos los datos. 

Se inició tratamientos acortados orales con bedaquilina y BpAL a partir de septiembre del 2021; las pruebas para resistencia a quinolonas se realizaron mediante métodos convencionales implementando pruebas MTB/XDR a partir de febrero 2022,la incorporación de casos diagnosticados en el 2021 al 2022.",4406,,427,,,,2060,,408,,226,,205,,131,18,,,,,,,,,,1,"En el numeral 2.32 que se reporta 2060 pruebas de resistencia a R y H corresponde al total de pruebas de todos los afectados nuevos y antes tratados, el sistema informativo no permite desglosar de acuerdo al requerimiento.

En el numeral 2.28 y 2.29 se reporta el total de pruebas, ya que el sistema de información no nos permite desglosar entre nuevos y antes tratados.

Ecuador no realiza pruebas de sensibilidad a bedaquilina y/o linezolid.",1,3200,579,579,1,223,26,,1,No se dispone de información desglosada por edades de los pacientes con TB nuevos y recaídas con VIH de 0 a 14 años que comenzó o continuó con la terapia antirretroviral (TAR).,579,0,,"Libros de registro de casos de los establecimientos de salud a nivel nacional
Nota: la OMS calcula estimaciones anuales del número de casos incidentes de TB entre personas que viven con el VIH. Las estimaciones de 2021, basadas en datos proporcionados por países",415,3513,0,,"Libros de registro de casos de los establecimientos de salud a nivel nacional
",92,3513,,,0,,"
NO SE TIENE EL DATO DESAGREGADO POR SEXO NI EDAD",,,1,,,2022-08-26,0,,,,,,,,,0,,,,,,
Estonia,EE,2021,77,11,4,10,5,0,4,0,92,107,19,111,77,14,0,19,1,220,0,0,0,,,2,2,,4,17,15,13,13,66,0,0,0,0,,,0,4,,5,3,4,8,17,41,0,0,60,87,,,,Data extracted from ECDC/TESSy 2022-08-26,16,9,0,12,0,7,1,,1,,1,,,1,"{2.14-2-20: Data extracted from ECDC/TESSy 2022-08-26}. 2.27 All MDR cases are monitored for adverse events, any details about treatment regimens are collected to TB register after result of treatment outcome. All MDR cases are consulted in MDR-TB consilium advisory board, all oral treatment regimens are preferred, also new drugs (bedaquiline, delamanid, pretonamid) are available, all MDR cases have individual treatment regimens according to DST, patient`s age, comorbidities, side effects",74,13,16,9,,,68,13,19,9,14,9,14,9,23,9,2,0,0,0,2,4,0,0,1,1,Data extracted from ECDC/TESSy 2022-08-26,1,99,12,10,,,,,1,,,,Reporting dates were not provided.,,,,,Reporting dates were not provided.,,,,,,,Reporting dates were not provided.,,,,,,,2022-08-26,0,,,,,,,,,1,"Costs of multidrug-resistant TB treatment in Finland and Estonia affected by the 2019 WHO guidelines.Feuth, T; Patovirta, R-L; Grierson, S; Danilovits, M; Viiklepp, P; Aaltonen, H K; Vauhkonen, M; Pehme, L; Vasankari, T (2021). Costs of multidrug-resistant TB treatment in Finland and Estonia affected by the 2019 WHO guidelines. The International Journal of Tuberculosis and Lung Disease, 25 (7), 554−559. DOI: 10.5588/ijtld.20.0892. ",18343,256,13,0,Data of 2021 deaths is preliminary form Estonian Causes of Death Registry.
Egypt,EG,2021,3328,0,3143,195,0,95,146,,6471,6761,436,6907,3328,341,0,584,1,221,79,,,143,,,,720,1096,851,556,495,325,4043,0,35,,,188,,,,593,512,385,309,297,177,2273,0,445,60,6037,,,0,,104,2,0,76,1,2,1,33,1,33,0,,76,0,,2962,306,75,25,,,2962,306,44,20,75,25,23,8,100,2,0,0,0,0,0,0,0,0,2,0,,0,3654,12,12,,,,,0,,,,Reporting dates were not provided.,,,,1,,,,,,,1,,,,,1,,,2022-08-26,0,,,,,,,,,0,,,,,,
Eritrea,ER,2021,622,326,543,76,21,15,23,,1491,1603,135,1626,622,76,0,0,1,221,73,,,80,,,,128,139,105,103,101,125,701,0,54,,,78,,,,119,129,116,92,93,68,617,0,285,60,1149,,,0,,26,0,0,26,0,0,1,26,1,26,0,,26,0,,622,76,23,3,,,0,0,0,0,0,0,0,0,0,0,0,0,0,0,0,0,0,0,0,0,,1,1576,41,41,,,,,0,,41,0,,,6,276,0,,,52,276,177,8775,0,,,,,1,,,2022-08-26,0,,,,,,,,,0,,,,,,
Spain,ES,2021,2123,283,965,0,0,0,138,5,3371,3371,138,3509,1385,97,738,1304,1,220,37,11,30,,,58,132,,324,335,383,328,461,2021,4,32,13,18,,,32,68,,243,222,192,137,303,1197,7,141,60,1323,,,,Data extracted from ECDC/TESSy 2022-08-26,33,1,0,0,0,0,,,,,,,,,{2.14-2-20: Data extracted from ECDC/TESSy 2022-08-26}. ,1046,60,25,1,,,1029,60,67,6,22,1,17,1,5,1,0,0,0,0,0,0,0,0,1,1,Data extracted from ECDC/TESSy 2022-08-26,,,,,,,,,,,,,Reporting dates were not provided.,,,,,Reporting dates were not provided.,,,,,,,Reporting dates were not provided.,,,,,,,2022-08-26,,,,,,,,,,,,,,,,
Ethiopia,ET,2021,43661,25676,32210,3059,,,248,,101547,104606,3307,104854,43661,3059,,,1,221,1612,,,3560,,,,13854,14740,9958,6827,4577,3202,53158,,1130,,,3923,,,,11645,12663,8031,4838,2624,1422,41223,,10225,0,,,,1,,514,4,0,514,26,4,1,376,1,279,1,126,324,0,,21240,2698,480,34,,,30,63,12,25,13,28,11,24,438,4,,,2,,,2,,,0,1,,1,86168,4467,4404,0,,,,1, Communication is underway with the National AIDS program to fix the discripancy.,4404,0,,"previously submitted data used ART register as a source data. As the TB-Unit register is the main and reliable data source for this indicator, Data is updated accordingly.
",1430,30505,0,,,19612,30505,187009,,0,,"
currently on ART  TPT data is from parallel report  only for few regions (6).

TPT data for currently / previously enrolled is not reported through the national HMIS /DHIS2 system. To fill the gap, regions collect and aggregate  HF level data for TPT backlog clearance. Such data is monitored at the facility level and reported parallelly for program monitoring purposes and it is reported only from few(6) regions. Therefore, we have decided to report the data ( TPT for currently enrolled ) using the data in hand. 

Recommendation - we can remove the TPT data for currently enrolled if it is not well justified, mainly for those who are previously enrolled.",,,0,Record removed by UNAIDS,"No age category data for 
TPT completion is higher than initiation; this  could be due to :
-Delayed TPT initiation for previously enrolled ART clients 
-Data quality issues in TB/HIV program
The same to 7.9, TPT completion is not reported through  DHIS2. The figure reported for this FY(2021) was collected parallelly from few regions. Though the period considers those who started TPT prior to the reporting period, the report is incomplete. This might be improved for future reporting periods as the indicators are being included under the revised list of indicators.",2022-08-26,0,,,,,,,,,0,,,,,,
Finland,FI,2021,105,10,52,2,0,1,0,0,167,170,3,170,101,2,4,70,1,220,1,0,0,,,5,9,,20,10,6,8,49,107,0,1,1,1,,,2,4,,12,3,5,5,28,59,0,4,60,105,,,,Data extracted from ECDC/TESSy 2022-08-26,3,0,0,1,0,0,1,2,1,2,0,,2,0,"{2.14-2-20: Data extracted from ECDC/TESSy 2022-08-26}. 3 patients were diagnosed with MDR/XDR-TB in Finland during the year 2021. However, one patient returned back to Estonia before treatment was started. Thus, only 2 patients received  treatment in Finland.",87,0,2,0,,,87,0,7,0,2,0,2,0,1,0,0,0,0,0,0,0,0,0,0,1,Data extracted from ECDC/TESSy 2022-08-26,1,,3,3,,,,,1,,,,Reporting dates were not provided.,,,,,Reporting dates were not provided.,,,,,,,Reporting dates were not provided.,,,,,,,2022-08-26,0,,,,,,,,,0,,,,,1,
Fiji,FJ,2021,132,126,72,5,5,2,30,,330,342,42,372,132,5,0,9,1,221,8,,,16,,,,28,43,34,35,25,17,182,0,11,,,15,,,,19,25,21,13,18,10,106,4,50,60,138,,,0,,4,0,0,3,1,0,1,2,0,,1,3,3,0,,127,5,4,0,,,0,0,0,0,0,0,0,0,0,0,0,0,0,0,0,0,0,0,0,0,,1,344,28,28,,,,,0,,,,Reporting dates were not provided.,,,,,Reporting dates were not provided.,,,,,,,Reporting dates were not provided.,,,,,,,2022-08-26,0,,,,,,,,,0,,,,,,
Micronesia (Federated States of),FM,2021,27,36,8,1,0,0,1,,71,72,2,73,27,1,0,3,1,220,3,3,1,,,2,4,,7,5,9,13,0,40,0,0,3,1,,,2,2,,4,3,5,5,0,21,0,11,60,54,,,0,,0,0,0,0,0,0,0,,0,,0,,0,0,,27,1,0,0,,,0,1,0,0,0,0,0,0,0,0,0,0,0,0,0,0,0,0,0,0,,1,72,0,0,,,,,0,,,,Reporting dates were not provided.,,,,,Reporting dates were not provided.,,,,,,,Reporting dates were not provided.,,,,,,,2022-08-26,0,,,,,,,,,0,,,,,,
Faroe Islands,FO,2021,,,,,,,,,,,,,,,,,,,,,,,,,,,,,,,,,,,,,,,,,,,,,,,,,,,,,,,,,,,,,,,,,,,,,,,,,,,,,,,,,,,,,,,,,,,,,,,,,,,,,,,,,,,,,,Reporting dates were not provided.,,,,,Reporting dates were not provided.,,,,,,,Reporting dates were not provided.,,,,,,,2022-08-26,,,,,,,,,,,,,,,,
France,FR,2021,1875,915,1294,0,0,0,235,55,4084,4084,235,4319,1183,126,692,2638,1,220,39,16,33,,,221,293,,648,417,286,215,504,2584,0,41,15,24,,,67,135,,270,252,195,132,281,1332,0,168,60,0,,,,Data extracted from ECDC/TESSy 2022-08-26,37,6,0,0,0,0,1,,1,,1,,,1,{2.14-2-20: Data extracted from ECDC/TESSy 2022-08-26}. ,17,6,17,6,,,13,4,13,4,13,4,13,4,16,3,0,0,0,0,0,0,0,3,0,1,Data extracted from ECDC/TESSy 2022-08-26,,,,,,,,,1,,,,Reporting dates were not provided.,,,,,Reporting dates were not provided.,,,,,,,Reporting dates were not provided.,,,,,,,2022-08-26,1,,,,,5.3,2020,4.2,6.5,1,,401,,401,1,2017 data
Gabon,GA,2021,2479,1721,644,118,100,11,128,,4844,5073,357,5201,2479,118,0,0,1,221,34,,,97,,,,628,938,666,440,216,114,3002,0,32,,,99,,,,415,567,386,215,143,83,1809,0,262,60,2665,,,0,,77,6,0,63,0,6,1,63,1,6,1,57,6,0,,807,118,45,32,,,802,118,45,32,45,32,45,32,56,4,,,,,,,,,,1, Le pays ne réalise pas les DST pour la bedaquiline et la linezolide.Mais seulement pour les fluoroquinolones et les aminosides.,1,1932,704,472,1,15,15,12,0,,472,0,,,472,704,0,,,,,,,0,Record removed by UNAIDS,,,,1,,,2022-08-26,0,,,,,,,,,0,,,,,,
United Kingdom of Great Britain and Northern Ireland,GB,2021,,,,,,,,,,,,,,,,,,,,,,,,,,,,,,,,,,,,,,,,,,,,,,,,,,,,,,0,,,,,,,,,,,,,,,,,,,,,,,,,,,,,,,,,,,,,,,,,,,,,,,,,,,,,,,,Reporting dates were not provided.,,,,,Reporting dates were not provided.,,,,,,,Reporting dates were not provided.,,,,,,,2022-08-26,,,,,,,,,,,,,,,,
Grenada,GD,2021,1,,,1,0,0,0,,1,2,1,2,1,1,0,0,1,220,,,,,,,,,,,1,1,,2,,,,,,,,,,,,,,,,,,60,0,,,1,,0,0,0,0,0,0,0,,0,,0,,0,1,,0,0,0,0,,,,,,,,,,,0,,,,,,,,,,,1,,1,2,0,0,1,0,0,0,1,,,,Reporting dates were not provided.,,,,,Reporting dates were not provided.,,,,,,,Reporting dates were not provided.,,,,,,,2022-08-26,0,,,,,,,,,0,,,,,,
Georgia,GE,2021,955,52,291,164,10,29,144,8,1298,1501,347,1645,955,286,0,,1,220,6,8,8,,,31,59,,164,215,206,199,116,990,0,5,7,13,,,25,51,,135,91,57,47,58,464,0,47,60,1403,,,1,,149,38,19,140,6,35,1,167,1,33,1,126,194,0,,953,267,101,79,,,790,177,149,83,88,64,84,62,148,37,2,2,0,5,21,0,1,4,2,1,,1,1430,43,43,,,,,0,,39,0,,,23,497,0,,,,,,,1,,,,,1,,,2022-08-26,0,,,,,,,,,0,,59906,7348,56,1,Number of deaths registered by the vital registration system of our country is not available until 1 July.
Ghana,GH,2021,8893,3098,888,459,55,8,245,,12879,13401,767,13646,8878,618,15,,1,221,162,,,183,,,,691,1707,2394,1899,1110,1027,8828,0,136,,,164,,,,483,743,830,680,451,523,3710,0,645,60,12525,,,1,"2.9 includes all new and relapse cases as per the 2013 WHO surveillance tools.  It however excluded disaggregation for RR and/or MDR-TB cases.  The NTP is revising the surveillance tools to conform with the 2021 revision.
2.11  This excludes Extrapulmonary cases for which there were no bacteriogical tests and cases diagnosed using smear microscopy",217,1,0,200,0,1,1,201,1,40,1,160,201,0,,8532,618,188,30,,,188,30,22,12,188,30,22,12,189,1,,,,,,,0,0,1,1,"Of the 218 RR-TB patients notified, 189 were tested for fluoroquinolone resistance",1,12632,1820,1753,,,,,0,,1753,0,,,1430,29405,0,,,,,19063,,0,,,,,1,,,2022-08-26,0,,,,,,,,,0,,,,,,
Greenland,GL,2021,24,4,3,3,0,0,0,0,31,34,3,34,24,3,0,0,1,220,1,,,,,1,1,,4,,2,5,6,19,0,,,,,,,2,,5,,3,1,3,14,0,1,60,32,,,1,,0,0,0,0,0,0,0,,0,,0,,,1,We are trying to get the information.,,,,,,,,,,,,,,,,,,,,,,,,,,1,,1,23,3,3,,,,,1,Probably are more than those recorded actually testet for HIV.,,,Reporting dates were not provided.,,,,,Reporting dates were not provided.,,,,,,,Reporting dates were not provided.,,,,,,,2022-08-26,0,,,,,,,,,1,,525,,1,1,Data still incomplete.
Gambia,GM,2021,1532,490,140,92,0,0,25,,2162,2254,117,2279,1532,117,0,0,1,221,19,,,38,,,,323,450,299,185,124,125,1506,0,14,,,48,,,,143,167,125,72,67,55,629,0,119,0,,,,1,,12,0,0,12,0,0,0,,0,,0,,12,1,,1175,117,3,9,,,217,0,217,0,3,0,3,0,0,0,0,0,0,0,0,0,0,0,0,1,,0,2004,260,231,,,,,0,,231,0,,,,,0,Record removed by UNAIDS,,,,,,1,,,,,1,,,2022-08-26,0,,,,,,,,,0,,,,,,
Guinea,GN,2021,10222,3394,4671,338,98,31,338,,18287,18754,805,19092,9441,338,781,,1,221,163,,,491,,,,1944,3032,2386,1718,1055,807,10942,0,149,,,439,,,,1453,1740,1415,923,582,457,6570,0,1242,60,5801,,,1,,376,16,0,315,6,9,1,164,1,6,1,151,322,0,,4242,338,227,165,,,143,171,131,148,129,165,122,147,189,16,,,,,,,,,,1,LE TEST POUR LA BEDAQUILINE ET LINEZOLIDE POUR LES PATIENTS PRE UR (2.37) N'EST DISPONIBLE,1,17276,3480,3392,0,,,,1,,,1,,,,,1,,,,,,,1,,,,,1,,,2022-08-26,0,,,,,,,,,1,,,,,,
Equatorial Guinea,GQ,2021,905,611,161,101,88,12,58,,1677,1878,259,1936,905,138,0,22,1,220,15,16,31,,,61,98,,295,238,154,96,49,991,0,9,18,21,,,98,114,,264,160,68,40,33,777,0,110,60,70,,,0,,35,0,0,35,1,0,1,2,0,,1,2,34,0,,492,77,23,12,,,0,0,0,0,0,0,0,0,0,0,,,,,,,,,,1,,1,1760,723,500,,,,,0,,,,Reporting dates were not provided.,,,,,Reporting dates were not provided.,,,,,,,Reporting dates were not provided.,,,,,,,2022-08-26,0,,,,,,,,,0,,,,,,
Greece,GR,2021,,,,,,,,,,,,,,,,,,,,,,,,,,,,,,,,,,,,,,,,,,,,,,,,,,,,,,,,,,,,,,,,,,,,,,,,,,,,,,,,,,,,,,,,,,,,,,,,,,,,,,,,,,,,,,Reporting dates were not provided.,,,,,Reporting dates were not provided.,,,,,,,Reporting dates were not provided.,,,,,,,2022-08-26,,,,,,,,,,,,,,,,
Guatemala,GT,2021,2132,450,262,202,28,15,61,,2844,3089,306,3150,2128,247,4,9,1,220,56,71,14,,,76,200,,395,331,292,198,196,1688,4,72,76,42,,,56,103,,234,197,206,155,113,1064,2,331,60,971,,,0,,64,6,5,55,5,5,1,59,1,5,1,54,64,0,,2022,235,34,30,,,92,111,15,55,13,27,9,6,44,6,0,0,0,0,0,0,0,0,6,0,"los datos 2.30 a 2.35 son datos reportados por el LNS, que no se lleva una base nominal de seguimiento. En el pais no se están realizando PSD a linezolid",1,3014,269,216,1,311,3,3,0,,216,0,,"METODOLOGÍA:
Para la construcción del numerador del indicador se utilizó la base de datos de Coinfección VIH-TB con datos nominales de las 16 Unidades de Atención Integral del MSPAS. En la base se registran todos los pacientes con Tuberculosis que tiene identificados el Programa de Tuberculosis, se utiliza la variable de ""VIH"" para seleccionar a aquellos pacientes con la opción ""R"" que significa que son positivos confirmado de VIH. Para identificar si reciben terapia combinada, se selección la opción ""Si"" de la variable de ""TARV"". 

No hay datos para poder desagregar el indicador por ciudad, esto debido a que los instrumentos no recolectan información de la ciudad de residencia de las personas actualmente.

Se utiliza el dato consensuado junto el Programa de Tuberculosis.
",161,1971,0,,"METODOLOGÍA:
Para la construcción del numerador del indicador se utilizó la base de datos de Coinfección VIH-TB con datos nominales de las 16 Unidades de Atención Integral del MSPAS. En la base se registran todos los pacientes con Tuberculosis que tiene identificados el Programa de Tuberculosis, se utiliza la variable de ""VIH"" para seleccionar a aquellos pacientes con la opción ""R"" que significa que son positivos confirmado de VIH. Para identificar si reciben tratamiento antirretroviral, se selección la opción ""Si"" de la variable de ""TARV"". Finalmente para identificar que son nuevos, se selecciona de la variable de ""Fecha de VIH"" el año 2021. 

Para la construcción del denominador se utilizó el número de personas consolidado de la sumatoria de lo reportado en el Anexo D ""Consolidado mensual de personas recibiendo terapia antirretroviral"" del cuadro de ""IV. PACIENTES CON VIH DE NUEVO INGRESO A LA UAI EN TAR EN EL MES DEL REPORTE"" y del Anexo F del cuadro de ""IX. PACIENTE",628,1971,3739,22466,0,,"METODOLOGÍA (Recién matriculados en la atención del VIH):
Para la construcción del numerador del indicador de personas recién inscritas en servicios de VIH con TAR que iniciaron tratamiento para la infección por tuberculosis latente; se utilizo el número consolidado de personas reportadas en el Anexo E ""Consolidado Mensual Infecciones oportunistas en personas con VIH"" del cuadro de ""VIII. PACIENTES VIH EN TAR QUE INICIAN TERAPIA PREVENTIVA DE LA TUBERCULOSIS (TPT) - (COHORTE NUEVOS)"" de las 16 Unidades de Atención Integral del MSPAS. Para las instituciones que no reportan en los anexos (IGSS; Sanidad Militar y Hospicio San José); se solicitó la información en matrices consolidadas, sin embargo, no reportaron datos para este indicador. 

Para la construcción del denominador se utilizó el número de personas consolidado de la sumatoria de lo reportado en el Anexo D ""Consolidado mensual de personas recibiendo terapia antirretroviral"" del cuadro de ""IV. PACIENTES CON VIH D",1008,1552,0,,"METODOLOGÍA:
Para la construcción del numerador del indicador se utilizó el número consolidado de personas reportadas en el Anexo E ""Consolidado Mensual Infecciones oportunistas en personas con VIH"" del cuadro de ""IX. PACIENTES VIH EN TAR QUE COMPLETARON UN CICLO DE TPT EN EL MES DE REPORTE - (COHORTE TOTAL)"" y del cuadro de ""X. PACIENTES VIH EN TAR QUE COMPLETARON UN CICLO DE TPT EN EL MES DE REPORTE - (COHORTE NUEVOS)"" de las 16 Unidades de Atención Integral del MSPAS. Para las instituciones que no reportan en los anexos (IGSS; Sanidad Militar y Hospicio San José); se solicitó la información en matrices consolidadas, sin embargo, no reportaron datos para este indicador. 

Para la construcción del denominador se utilizó el dato de personas con VIH en TAR que comenzaron TPT el año pasado (2020).

No hay datos para poder desagregar el indicador por ciudad, esto debido a que los instrumentos no recolectan información de la ciudad de residencia de las personas actualment",2022-08-26,0,,,,,,,,,0,,,,,,
Guam,GU,2021,38,15,3,2,0,0,0,,56,58,2,58,38,2,0,32,1,220,1,1,0,,,2,4,,4,2,8,10,6,36,0,1,2,0,,,1,3,,0,5,3,2,3,17,0,5,60,39,,,0,,1,0,0,1,0,0,1,1,1,1,0,,1,0,,35,2,1,0,,,35,2,4,0,1,0,1,0,1,0,0,0,0,0,0,0,0,0,0,0,,0,52,1,1,,,,,0,,,,Reporting dates were not provided.,,,,,Reporting dates were not provided.,,,,,,,Reporting dates were not provided.,,,,,,,2022-08-26,0,,,,,,,,,0,,,,,,
