country,iso2,year,new.labconf,new.clindx,new.ep,ret.rel.labconf,ret.rel.clindx,ret.rel.ep,ret.nrel,ret.nrel.clindx,c.newunk,c.newinc,c.ret,c.notified,pulm.labconf.new,pulm.labconf.ret,pulm.labconf.unk,notif.foreign,rel.in.agesex.flg,agegroup.option,newrel.m04,newrel.m59,newrel.m1014,newrel.m514,newrel.m014,newrel.m1519,newrel.m2024,newrel.m1524,newrel.m2534,newrel.m3544,newrel.m4554,newrel.m5564,newrel.m65,newrel.m15plus,newrel.mu,newrel.f04,newrel.f59,newrel.f1014,newrel.f514,newrel.f014,newrel.f1519,newrel.f2024,newrel.f1524,newrel.f2534,newrel.f3544,newrel.f4554,newrel.f5564,newrel.f65,newrel.f15plus,newrel.fu,c.new.014,rdx.data.available,newinc.rdx,rdxsurvey.newinc,rdxsurvey.newinc.rdx,gaps.na.tbcases,remarks.tbcases,conf.rr.nfqr,conf.rr.fqr,unconf.rr.nfqr.tx,conf.rr.nfqr.tx,rrmdr.014.tx,conf.rr.fqr.tx,mdrxdr.bdq.used,mdrxdr.bdq.tx,mdrxdr.alloral.used,mdrxdr.alloral.tx,mdr.alloral.short.used,mdr.alloral.short.tx,mdr.tx.adsm,gaps.na.mdr.patients,remarks.mdr.patients,r.rlt.new,r.rlt.ret,rr.new,rr.ret,r.rlt.rel,rr.rel,dst.rlt.new,dst.rlt.ret,dst.rlt.hr.new,dst.rlt.hr.ret,dst.rlt.rr.new,dst.rlt.rr.ret,mdr.new,mdr.ret,rr.dst.rlt.fq,rr.fqr,rr.fqr.bdqr.lzdr,rr.fqr.bdqs.lzdr,rr.fqr.bdqu.lzdr,rr.fqr.bdqr.lzds,rr.fqr.bdqs.lzds,rr.fqr.bdqu.lzds,rr.fqr.bdqr.lzdu,rr.fqr.bdqs.lzdu,rr.fqr.bdqu.lzdu,gaps.na.dr.surveillance,remarks.dr.surveillance,newrel.tbhiv.flg,newrel.hivtest,newrel.hivpos,newrel.art,tbhiv.014.flg,newrel.hivtest.014,newrel.hivpos.014,newrel.art.014,gaps.na.hiv.patients,remarks.hiv.patients,hiv.tbrx.art,hiv.tbrx.art.NA,hiv.tbrx.art.NI.reason,hiv.tbrx.art.remarks,hiv.tbdetect,hiv.reg.new2,hiv.tbdetect.hiv.reg.new2.NA,hiv.tbdetect.hiv.reg.new2.NI.reason,hiv.tbdetect.hiv.reg.new2.remarks,hiv.new.tpt,hiv.new,hiv.all.tpt,hiv.all,hiv.tpt.eligible.start.NA,hiv.tpt.eligible.start.NI.reason,hiv.tpt.eligible.start.remarks,hiv.all.tpt.completed,hiv.all.tpt.started,hiv.tpt.completed.NA,hiv.tpt.completed.NI.reason,hiv.tpt.completed.remarks,hiv.unaids.date.exported,tbhiv.surveil,tbhiv.surv.prev,tbhiv.surv.yr,tbhiv.surv.cil,tbhiv.surv.ciu,tbhiv.sentin.prev,tbhiv.sentin.yr,tbhiv.sentin.cil,tbhiv.sentin.ciu,gaps.na.nonroutine.hiv,remarks.nonroutine.hiv,total.deaths.vr,r00.r99.deaths.vr,tbdeaths.vr,gaps.na.tbdeaths,remarks.tbdeaths
Andorra,AD,2021,2,0,0,,,,0,0,2,2,0,2,2,,,0,1,220,,,,,,,,,,,1,,,1,,,,,,,,,,,1,,,,1,,,60,0,,,1,,0,0,0,0,0,0,0,,0,,0,,,1,,2,,0,,,,2,0,0,0,0,0,0,0,,,,,,,,,,,,1,En relación con E2.DRS2: Uno de los casos es nacido fuera del país aunque hace años que es residente en Andorra.,1,0,0,0,,,,,1,,,,Reporting dates were not provided.,,,,,Reporting dates were not provided.,,,,,,,Reporting dates were not provided.,,,,,,,2022-08-26,0,,,,,,,,,1,,,,0,1,
United Arab Emirates,AE,2021,33,4,29,1,0,0,1,,66,67,2,68,33,2,0,0,,221,2,,,2,,,,11,8,8,7,6,2,42,0,0,,,1,,,,4,5,2,2,3,4,20,0,5,60,25,,,0,,0,0,0,0,0,0,0,,0,,0,,0,0,,23,2,0,0,,,10,0,0,0,0,0,0,0,0,0,0,0,0,0,0,0,0,0,0,0,,1,50,1,1,,,,,0,,1,0,,,1,87,0,,,1,87,,,0,,,4,6,0,,,2022-08-26,0,,,,,,,,,0,,,,,,
Afghanistan,AF,2021,24715,12254,12699,501,93,62,386,,49668,50324,1042,50710,24715,887,0,0,1,221,2939,,,2770,,,,4358,3379,2194,1872,2100,2529,16432,0,2180,,,3331,,,,6044,5136,3605,2998,2802,2087,22672,0,11220,60,18981,,,0,,459,123,0,392,32,20,1,264,1,258,1,114,20,0,,17443,501,390,69,,,,,,,,,,,413,123,,,,,,,,,,1,"The available lab-data do not have DST for Rif and INH separately New and Previously Treated Cases) but mixed of them are available (among  467 DST were performed for Rif, 182 were found to be RRTB and 285 were sensitive to Rif> among  414 DST were performed for INH, 149 were found to be HrTB and 265 were sensitive to INH.  ",1,31278,2,2,,,,,0,,2,0,,,2,117,0,,,34,117,34,1141,0,,,,,1,,,2022-08-26,0,,,,,,,,,0,,,,,,
Antigua and Barbuda,AG,2021,3,1,0,0,0,0,,,4,4,0,4,3,0,0,3,1,222,,,,,0,,,,,,1,1,,2,,,,,,,,,1,,1,,,,2,,0,60,4,,,0,,0,0,0,0,0,0,0,,0,,0,,0,0,,0,0,0,0,,,0,0,0,0,0,0,0,0,0,0,0,0,0,0,0,0,0,0,0,0,,1,4,0,0,1,0,0,0,0,,,1,,,,,1,,,,,,,1,,,,,1,,,2022-08-26,0,,,,,,,,,0,,,,,,
Anguilla,AI,2021,0,0,0,0,0,0,0,,0,0,0,0,0,0,0,0,,,,,,,,,,,,,,,,,,,,,,,,,,,,,,,,,,5,,,,0,No new cases of TB were diagnosed in 2021,,,,,,,,,,,,,,0,Not applicable - no cases were diagnosed ,,,,,,,,,,,,,,,,,,,,,,,,,,0,Not appplicable,,,,,0,,,,0,Not applicable - no cases were diagnosed ,,,Reporting dates were not provided.,,,,,Reporting dates were not provided.,,,,,,,Reporting dates were not provided.,,,,,,,2022-08-26,0,,,,,,,,,0,,,,,,
Albania,AL,2021,168,43,50,5,3,0,0,0,261,269,8,269,168,5,0,0,1,220,3,0,1,,,4,23,,28,21,27,29,39,171,0,1,1,2,,,6,19,,20,13,6,5,21,90,0,8,60,158,,,1,,6,,0,5,0,,1,5,1,2,1,3,0,1,,154,4,5,1,,,99,4,7,1,5,1,1,0,0,,,,,,,,,,,1,,1,244,1,1,,,,,1,,1,0,,,1,107,0,,,,,,,1,,,,,1,,,2022-08-26,0,,,,,,,,,1,,,,9,1,
Armenia,AM,2021,209,55,105,20,3,6,28,1,369,398,57,426,209,47,0,2,1,220,9,2,3,,,15,8,,41,59,78,61,34,296,0,0,2,2,,,3,6,,23,18,4,17,13,84,0,18,60,326,,,0,,47,17,3,47,0,17,1,60,1,21,1,29,23,0,,209,47,44,20,,,209,47,72,18,44,20,42,18,57,17,,,,,,7,,,10,1,,1,335,36,,,,,,1,,36,0,,,31,371,0,,,106,,,,0,,,,,1,,,2022-08-26,0,,,,,,,,,0,,,,,1,
Angola,AO,2021,31113,23841,3466,2460,742,69,2279,,58420,61691,5550,63970,30949,2460,164,6,1,221,1143,,,2122,,,,8042,8972,6268,3936,2295,1522,31035,9,1091,,,2357,,,,7038,6222,4562,3123,1892,1092,23929,5,6713,0,,,,0, ,1232,0,0,1232,31,0,1,1232,3,,3,,0,0,,10250,1100,759,473,540,151,759,473,759,473,759,473,759,473,,,,,,,,,,,,1,Nous n'avons pas encore initié les tests de sensibilité aux médicaments anti-tuberculeux de deuxième ligne,0,45238,5619,3597,,,,,0,,,,Reporting dates were not provided.,,,,,Reporting dates were not provided.,,,,,,,Reporting dates were not provided.,,,,,,,2022-08-26,0,,,,,,,,,0,,,,,,
Argentina,AR,2021,8352,2228,1027,244,51,25,613,,11607,11927,933,12540,6341,723,2011,1019,1,220,133,106,152,,,612,782,,1402,1149,937,852,631,6365,9,119,79,204,,,579,658,,1149,709,590,520,435,4640,3,793,60,697,,,0,"* 2.6 Los datos consignados son por País de Nacimiento
* 2.9 Hay 117 casos sin infromación de sexo",166,10,0,166,6,10,1,23,1,,0,,,0,"2.27 No se cuenta con registro de vigilancia del monitoreo para detectar efectos adversos, esa información se regista a nivel del establecimiento que hace el seguimiento del tratamiento del paciente.",2309,341,100,36,,,394,117,126,47,83,31,74,27,127,10,0,0,0,0,5,4,0,0,1,0,,1,2505,999,623,1,124,7,6,0,,623,0,,,,,1,,,,,,,1,,,,,1,,,2022-08-26,0,,,,,,,,,0,,,,,,
American Samoa,AS,2021,,,,,,,,,,,,,,,,,,,,,,,,,,,,,,,,,,,,,,,,,,,,,,,,,,,,,,,,,,,,,,,,,,,,,,,,,,,,,,,,,,,,,,,,,,,,,,,,,,,,,,,,,,,,,,Reporting dates were not provided.,,,,,Reporting dates were not provided.,,,,,,,Reporting dates were not provided.,,,,,,,2022-08-26,,,,,,,,,,,,,,,,
Austria,AT,2021,251,20,102,11,1,2,9,3,373,387,23,396,190,17,61,252,1,220,2,2,3,,,21,25,,43,31,38,39,56,253,0,3,2,2,,,3,9,,28,23,19,7,31,120,0,14,60,281,,,,Data extracted from ECDC/TESSy 2022-08-26,7,2,0,0,0,0,,,,,,,,,{2.14-2-20: Data extracted from ECDC/TESSy 2022-08-26}. ,165,12,8,0,,,164,12,22,1,8,0,8,0,8,1,0,0,0,0,0,1,0,0,0,1,Data extracted from ECDC/TESSy 2022-08-26,,,,,,,,,,,,,Reporting dates were not provided.,,,,,Reporting dates were not provided.,,,,,,,Reporting dates were not provided.,,,,,,,2022-08-26,,,,,,,,,,,,,,,,
Australia,AU,2021,721,102,593,31,3,18,0,,1416,1468,52,1468,715,31,6,1332,1,222,,,,,16,,,114,202,121,89,83,156,765,6,,,,,18,,,97,199,129,67,74,92,658,5,34,0,,,,0,"Total cases = 1,470 however 2 cases were excluded as pulmonary/extra pulmonary site was not reported.

Unknown cases (2.9) includes cases for whom sex and age was not recorded and where treatment history was unknown.",21,3,0,18,0,3,1,21,1,13,1,4,20,0,,597,22,9,3,,,597,22,47,5,9,3,7,3,12,1,0,0,0,0,0,0,0,0,1,0,See general remarks,1,1311,15,,,,,,1,See general remarks,,,Reporting dates were not provided.,,,,,Reporting dates were not provided.,,,,,,,Reporting dates were not provided.,,,,,,,2022-08-26,0,,,,,,,,,0,See general remarks,,,,,
Aruba,AW,2021,6,0,0,,,,0,,6,6,0,6,6,0,0,3,0,222,,,,,0,,,0,0,0,0,2,2,4,,,,,,0,,,0,0,1,0,1,0,2,,0,0,,,,1,,0,0,0,0,0,0,3,,,,3,,0,1,,6,0,0,0,,,0,0,0,0,0,0,0,0,0,0,,,,,,,,,,1,,0,0,0,0,1,0,0,0,1,,,,Reporting dates were not provided.,,,,,Reporting dates were not provided.,,,,,,,Reporting dates were not provided.,,,,,,,2022-08-26,0,,,,,,,,,0,,,,,,
Azerbaijan,AZ,2021,1466,556,513,990,96,42,1281,104,2535,3663,2409,4944,1466,2168,,,0,221,12,,,29,,,,331,335,292,272,294,115,1639,,7,,,29,,,,182,219,114,91,137,76,819,,77,60,3125,,,1,,869,171,2,798,10,164,1,949,1,688,1,112,964,0,,1409,2159,172,487,985,133,1409,2159,205,450,172,487,113,276,592,114,7,16,,8,67,,,,16,1,,0,4448,92,90,,,,,0,,63,0,,,37,662,0,,,,,,,0,Record removed by UNAIDS,,343,620,0,,,2022-08-26,0,,,,,,,,,1,,,,,,
Bosnia and Herzegovina,BA,2021,261,48,21,24,8,0,1,0,330,362,33,363,261,24,0,10,1,220,0,0,0,,,5,21,,36,26,39,44,55,226,0,0,0,1,,,7,17,,9,14,17,16,55,135,0,1,60,1,,,0,"2.10 Answer NO was given by FBIH. 
2.11 Data provided by RS.",1,,0,1,0,,0,,0,,1,1,0,1,"2.17 Data refer to FBIH.
2.21 Response refers to FBIH and RS.
2.23 Answer provided by FBIH.
2.25 Answer YES was provided by FBIH, while answer NO was provided by RS. 
2.26. Answer refers to FBIH.",255,24,1,1,,,255,24,0,0,1,1,,,0,0,,,,,,,,,,1,,,,,,,,,,1,,,,Reporting dates were not provided.,,,,,Reporting dates were not provided.,,,,,,,Reporting dates were not provided.,,,,,,,2022-08-26,0,,,,,,,,,1,"Answer to question 3.1a was provided by FBIH and RS. 
Answers to questions 3.1b and 3.1c were provided by FBIH.
Answer to question 3.2 was provided by RS.
",,,,1,
Barbados,BB,2021,1,0,0,0,0,0,0,,1,1,0,1,1,0,0,0,0,220,0,0,0,,,0,0,,0,1,0,0,0,1,0,0,0,0,,,0,0,,0,0,0,0,0,0,0,0,60,1,,,0,Only one case in 2021. It was bacteriologically diagnosed.,0,0,0,0,0,0,0,,1,0,0,,0,0,We had no drug resistance case.,0,0,0,0,,,0,0,0,0,0,0,0,0,0,0,0,0,0,0,0,0,0,0,0,0,We do not have any drug resistance case.,0,0,0,0,1,0,0,0,0,We do not have any TB/HIV co infection.,0,0,,,0,53,0,,,0,53,0,1439,0,,,0,0,0,,,2022-08-26,0,,,,,,,,,0,No non-routine surveillance of HIV prevalence in TB patients,,,,,
Bangladesh,BD,2021,190460,45325,55994,7675,4993,2254,860,,291779,306701,15782,307561,190455,8344,5,0,1,221,596,,,4304,,,,14469,20706,24379,30121,33790,38290,161755,8,416,,,5111,,,,18707,24791,27189,27147,21652,15019,134505,6,10427,60,73968,,,0,,1495,106,0,1384,22,104,1,817,1,23,1,676,1481,0,,82924,8119,1108,420,7675,217,0,0,0,0,0,0,0,0,652,94,,,,,,,,,,1,,0,19656,106,102,,,,,0,,,0,Record removed by UNAIDS,,51,642,0,,,,,,,1,,,,,1,,,2022-08-26,0,,,,,,,,,0,,,,,,
Belgium,BE,2021,518,52,247,,,,58,2,817,817,58,875,437,34,81,549,1,220,6,2,15,,,55,90,,113,79,76,50,69,532,0,6,2,10,,,14,23,,83,49,28,16,31,244,0,41,60,586,,,,Data extracted from ECDC/TESSy 2022-08-26,8,0,0,8,0,0,1,8,1,4,1,3,8,0,{2.14-2-20: Data extracted from ECDC/TESSy 2022-08-26}. ,377,24,3,2,,,375,24,19,5,3,2,3,2,5,0,0,0,0,0,0,0,0,0,0,1,Data extracted from ECDC/TESSy 2022-08-26,1,428,24,,,,,,1,,,,Reporting dates were not provided.,,,,,Reporting dates were not provided.,,,,,,,Reporting dates were not provided.,,,,,,,2022-08-26,0,,,,,,,,,0,,108745,8410,39,0,figures for year 2019 (latest available)
Burkina Faso,BF,2021,4536,1024,991,253,60,18,312,,6551,6882,643,7194,4523,288,13,,,221,42,,,69,,,,520,1317,1310,847,598,461,5053,,37,,,65,,,,260,335,345,294,206,176,1616,,213,60,3042,,,1,Une discordance ,82,3,0,75,0,3,1,78,1,0,1,75,78,0,,3042,183,72,10,,,52,9,50,9,51,9,49,9,61,3,0,0,0,0,0,0,0,0,3,1,,1,6668,385,367,,,,,1,Un doublon de 18 cas a été identifié et supprimé,385,0,,,,,0,Record removed by UNAIDS,,,,6441,74340,0,,"ENDOS BF
",,,1,,,2022-08-26,0,,,,,,,,,0,,,,,,
Bulgaria,BG,2021,,,,,,,,,,,,,,,,,,,,,,,,,,,,,,,,,,,,,,,,,,,,,,,,,,,,,,,,,,,,,,,,,,,,,0,,,,,,,,,,,,,,,,,,,,,,,,,,,,,1,478,0,0,,,,,0,,,,Reporting dates were not provided.,,,,,Reporting dates were not provided.,,,,,,,Reporting dates were not provided.,,,,,,,2022-08-26,0,,,,,,,,,0,,,,15,1,
Bahrain,BH,2021,119,6,71,0,0,0,0,,196,196,0,196,119,0,,162,0,221,0,,,1,,,,8,31,46,27,11,7,130,,0,,,0,,,,11,22,15,12,5,0,65,,1,60,182,,,0,,1,0,0,1,0,0,0,,3,,3,,,1,,112,0,1,0,,,112,0,0,0,1,0,0,0,0,0,,,,,,,,,,0,,1,144,5,1,,,,,1,,,,Reporting dates were not provided.,,,,,Reporting dates were not provided.,,,,,,,Reporting dates were not provided.,,,,,,,2022-08-26,0,,,,,,,,,0,,,,,,
Burundi,BI,2021,4090,600,1710,230,75,83,86,,6400,6788,474,6874,4090,230,0,0,1,221,54,,,114,,,,511,1115,1009,782,563,445,4425,0,33,,,89,,,,386,510,413,271,244,249,2073,0,290,60,3387,,,0,"L'intérpretation du point 2.11 prête confusion pour certains. En effet, ces derniers prennent comme dénominateur tous les patients tuberculeux enregistrés au cours de la période, d'autres prennent la somme de 2.1 & 2.3, d'autres encore excluent les extrapulmonaires,car non testés au Xpert MTB/RIF. 
Bref, une assistance technique de l'OMS nous serait d'une importance capitale.  ",46,0,0,46,0,0,0,,0,,0,,46,1,"Tous les patients TB/RR enregistrés en 2021 ont un âge > à 15 ans
Le traitement avec Bédaquiline est envisagé pour cette année. ",1272,25,44,2,,,0,0,0,0,0,0,0,0,0,0,0,0,0,0,0,0,0,0,0,1,Les tests de sensibilité de 1ère et 2ème lignes n'ont pas été faits au cours de l'année 2021.,1,6759,387,387,,,,,0,"La mise à jour effectuée par rapport aux données 2020, fait suite au message mail OMS transmis en Février 2022 qui a prêté confusion. A cette occasion,les données de 2020 avaient été effacées au détriment de celles de l'année 2021.  
Le rapport 2021 du Programme TB fait état de 249 PVVIH connues,qui ont développé la tuberculose et 138 Tuberculeux testés VIH positifs grâce au dépistage VIH initié par le prestataire.",,,Reporting dates were not provided.,,,,,Reporting dates were not provided.,,,,,,,Reporting dates were not provided.,,,,,,,2022-08-26,0,,,,,,,,,0,L'enquête de pharmacorésistance est en cours de réalisation. Elle a commencé en juillet 2021,,,,,
Benin,BJ,2021,3010,347,202,152,0,0,53,,3559,3711,205,3764,3010,205,0,0,1,221,32,,,43,,,,342,597,599,444,245,169,2396,0,19,,,44,,,,253,316,284,165,95,64,1177,0,138,60,2782,,,1,,34,0,0,29,0,0,0,,0,,0,,29,1,,2647,205,29,5,,,21,93,10,13,18,3,10,1,24,0,,,,,,,,,,1,,1,3645,495,477,,,,,1,,,0,Record removed by UNAIDS,,477,6392,0,,,,,,,1,,,,,0,Record removed by UNAIDS,,2022-08-26,0,,,,,,,,,1,,,,,,
Bermuda,BM,2021,2,0,0,0,0,0,0,,2,2,0,2,2,0,0,2,1,220,0,0,0,,,0,0,,0,0,1,0,0,1,0,0,0,0,,,0,0,,1,0,0,0,0,1,0,0,60,0,,,0,2.8 There were no relapse cases recorded in 2021,0,0,0,0,0,0,0,,0,,0,,0,0,,2,0,0,0,,,2,0,0,0,0,0,0,0,0,0,0,0,0,0,0,0,0,0,0,0,There were no pre-XDR nor XDR-TB cases reported in 2021,1,2,0,0,1,0,0,0,0,There were no TB patients aged 0-14 years in 2021,,,Reporting dates were not provided.,,,,,Reporting dates were not provided.,,,,,,,Reporting dates were not provided.,,,,,,,2022-08-26,0,,,,,,,,,0,,,,,,
Brunei Darussalam,BN,2021,162,13,40,14,0,6,0,,215,235,20,235,162,14,0,71,1,220,1,0,0,,,5,7,,19,21,30,27,33,142,0,0,0,0,,,7,9,,19,12,15,13,17,92,0,1,0,,,,1,,0,0,0,0,0,0,0,,0,,0,,0,0,,162,14,0,0,,,162,14,2,0,0,0,0,0,0,0,0,0,0,0,0,0,0,0,0,0,,1,235,4,4,,,,,0,,,,Reporting dates were not provided.,,,,,Reporting dates were not provided.,,,,,,,Reporting dates were not provided.,,,,,,,2022-08-26,0,,,,,,,,,0,,,,,,
Bolivia (Plurinational State of),BO,2021,5107,362,1227,357,0,18,127,,6696,7071,502,7198,5107,481,0,0,1,221,22,,,101,,,,979,931,614,556,561,711,4352,0,22,,,85,,,,594,565,311,293,304,422,2489,0,230,60,5157,,,0,,141,0,0,94,6,0,0,,0,,0,,94,0,,5085,811,92,28,,,296,303,51,21,55,12,37,7,75,0,0,0,0,0,0,0,0,0,0,0,,0,6239,278,,0,,,,1,,,1,,"Las estimaciones de personas coinfectadas son preliminares, son producto de la revisión conjunta de los registros de VIH y TB.
",274,2736,0,,"Los datos presentados respecto al número de coinfectados son preliminares, son producto de la revisión de registros tanto de VIH como de TB; incluye PVVS tanto antiguas como nuevas, por lo que puede existir cierto sesgo en el cálculo del indicador.
",,,,,1,,,,,1,,,2022-08-26,0,,,,,,,,,0,,,,,,
Brazil,BR,2021,48694,14896,8976,4500,1325,442,9266,,72566,78833,15533,88099,48336,10959,358,539,1,220,550,237,403,,,2271,6593,,13300,10561,8494,6783,5427,53429,28,351,203,502,,,1681,2603,,4847,4368,3688,2914,3017,23118,12,2246,60,32531,,,1,,1039,68,43,794,9,68,1,206,1,131,0,,0,1,,24394,6057,538,303,,,5468,1553,237,116,144,104,41,46,,,,,,,,,,,,1,"2.36 and 2.37: The Brazilian information system doesn´t have this information for all RR-TB. This information is just available in MDR-TB information system

2.38 to 2.42:bedaquiline and linezolid testing is not available in Brazil",1,63004,6870,3551,1,1440,55,26,1,2.46: The TB information system in Brazil is very dynamic and the database is often qualified. ,3024,0,,,,,1,,"We only have the total number of reported tuberculosis cases that were simultaneously infected with HIV.
We can not, based on our information system, know if they are new cases of HIV/AIDS.
",,,,,1,,,,,1,,,2022-08-26,0,,,,,,,,,1,,,,,,
Bahamas,BS,2021,12,32,0,0,0,0,0,,44,44,0,44,12,0,0,15,,220,1,0,0,,,0,0,,7,4,8,12,2,33,0,1,0,0,,,1,0,,4,1,0,1,2,9,0,2,60,14,,,1,No Relapse cases identified in 2021,0,0,0,0,0,0,0,,0,,0,,0,0,,12,0,0,0,,,,,,,,,,,,,,,,,,,,,,1,The majority of sputum specimens were outsourced to the regional reference lab-CARPHA. The National laboratory responsible for TB testing was unable to perform these tests and subsequent sensitivity testing due to the absence of a Biosafety Cabinet.,1,42,14,14,1,3,0,,1,not applicable,14,0,,,8,308,0,,,0,308,0,3047,0,,,,,1,,,2022-08-26,0,,,,,,,,,0,,,,,,
Bhutan,BT,2021,433,47,308,31,7,28,4,,788,854,70,858,433,34,0,8,1,221,1,,,7,,,,123,97,43,47,28,47,385,0,0,,,8,,,,184,128,51,36,20,34,453,0,16,60,528,,,0,,55,3,0,55,1,1,1,55,1,17,1,38,55,0,,419,26,44,1,,,385,23,48,1,39,0,36,0,37,3,,,,,,,,,3,1,"In 2.28, there is no provision for entering Extra-pulmonary TB cases tested for RIF. Total of 10 RR/MDR-TB was diagnosed among EPTB cases (8 New & 2 previously treated case) and is not included in line 2.29.",1,854,3,3,,,,,0,,,,Reporting dates were not provided.,,,,,Reporting dates were not provided.,,,,,,,Reporting dates were not provided.,,,,,,,2022-08-26,0,,,,,,,,,0,,,,,,
Botswana,BW,2021,1290,731,276,31,16,6,18,,2297,2350,71,2368,1206,37,84,89,1,220,27,14,20,,,49,112,,266,366,269,169,179,1410,0,35,10,16,,,66,101,,223,191,110,75,70,836,0,122,60,1325,,,0,,15,0,0,35,0,0,1,35,1,35,0,,35,0,ALL DR-TB PATIENTS ARE TAKING A REGIMEN CONTAINING BEDAQUELINE EVEN THOUGH THE COUNTRY IS STILL USING LONGER REGIMEN,,,,,,,,,,,,,,,,,,,,,,,,,,0,,1,2176,974,885,1,96,12,11,0,,,,Reporting dates were not provided.,,,,,Reporting dates were not provided.,,,,,,,Reporting dates were not provided.,,,,,,,2022-08-26,0,,,,,,,,,0,,,,,,
Belarus,BY,2021,1032,47,97,300,2,6,212,13,1176,1484,520,1696,1032,499,0,0,1,220,2,0,2,,,6,25,,111,288,313,269,119,1131,0,0,1,0,,,7,13,,40,90,45,58,95,348,0,5,60,1401,,,0,,491,310,1,451,1,276,1,684,1,158,1,294,727,0,,1032,499,390,367,300,207,1032,499,416,373,390,367,341,354,757,310,,,,,,,,,,1,В E2.DRS3-E2.DRS6 представлены данные только по НРЛ,1,1484,128,111,,,,,0,,109,0,,"Статистические данные Министерства здравоохранения Республики Беларусь
",54,1772,0,,,1128,1772,1128,19888,0,,"Статистические данные Министерства здравоохранения Республики Беларусь
",,,0,Record removed by UNAIDS,,2022-08-26,0,,,,,,,,,0,,,,109,1,
Belize,BZ,2021,51,8,3,8,2,0,0,,62,72,10,72,51,8,0,11,1,220,0,0,0,,,1,3,,5,10,14,11,5,49,0,0,2,0,,,3,5,,8,1,3,1,0,21,0,2,60,57,,,1,,1,0,1,1,0,0,1,1,0,,1,1,0,1,,46,6,0,1,,,46,6,0,1,0,1,0,1,0,0,0,0,0,0,0,0,0,0,0,1,,1,60,15,15,1,1,1,1,1,,,,Reporting dates were not provided.,,,,,Reporting dates were not provided.,,,,,,,Reporting dates were not provided.,,,,,,,2022-08-26,0,,,,,,,,,0,,,,,,
Canada,CA,2021,,,,,,,,,,,,,,,,,,,,,,,,,,,,,,,,,,,,,,,,,,,,,,,,,,,,,,,,,,,,,,,,,,,,,,,,,,,,,,,,,,,,,,,,,,,,,,,,,,,,,,,,,,,,,1,,"Canada does not collect this information at the national level.
",,,1,,"Canada does not collect this information at the national level.
",,,,,1,,"Canada does not collect this information at the national level.
",,,1,,"Canada does not collect this information at the national level.
",2022-08-26,,,,,,,,,,,,,,,,
Democratic Republic of the Congo,CD,2021,128141,44171,36867,2919,1737,573,1379,,209179,214408,6608,215787,128141,3705,0,,1,221,4184,,,9622,,,,18187,23989,24340,18988,13646,8348,107498,60,3511,,,9456,,,,15706,17515,16994,13408,10241,6152,80016,61,26773,60,20148,,,1,,1236,25,0,1125,59,17,1,690,1,29,1,644,824,0,,28577,3016,653,583,2292,161,235,218,188,167,235,218,188,167,583,25,0,0,0,0,0,0,0,0,25,0,,0,167052,13373,10990,0,,,,0,,10990,0,,,6459,96516,0,,,55640,96516,,,0,,,,,1,,,2022-08-26,0,,,,,,,,,1,,,,,,
Central African Republic,CF,2021,6813,3458,2521,255,84,85,212,,12792,13216,636,13428,6770,255,43,0,1,221,346,,,518,,,,1057,1728,1602,1232,662,352,6633,0,349,,,480,,,,1033,1370,1082,733,361,233,4812,0,1693,60,2598,,,1,"1) La désagrégation par tranche d'âge et sexe n'a pris en compte qu'une partie des données notamment celles de l'Institut Pasteur de Bangui.
2) Le nombre de tests réalisés chez les nouveaux cas et rechutes n'a concerné que les laboratoires de : Institut Pasteur de Bangui; Saint Michel de Bouar et le Laboratoire de Biologie Clinique et de Santé Publique. Les données des autres laboratoires ne font pas la différence entre les nouveaux, les rechutes et les autres cas retraitement.
",119,0,0,100,4,0,0,,0,,0,,0,0,,660,53,54,27,,,32,14,31,11,31,13,31,11,53,0,0,0,0,0,0,0,0,0,0,0,"*Pour les questions 2.28 et 2.29, les résultats concernent uniquement trois laboratoires, Institut Pasteur de Bangui, Laboratoire National de Biologie Clinique et de Santé Publique et labortoire Saint Michel de Bouar qui dans leur base de données ont mentionné les antécédents des patients.

*Les question 2.30, 2.31, 2.33 et 2.34 sont uniquement les données de l'Institut Pasteur de Bangui.",1,10627,2940,2853,0,,,,0,,3003,0,,,,,1,,,,,,,0,Record removed by UNAIDS,,2544,2966,0,,,2022-08-26,0,,,,,,,,,0,,,,,,
Congo,CG,2021,4718,4189,2891,90,58,33,173,,11798,11979,354,12152,4718,90,0,,1,221,152,,,327,,,,1089,1565,1517,1137,663,429,6400,0,128,,,292,,,,913,997,927,755,548,540,4680,0,899,60,4847,,,1,,133,0,0,131,5,0,1,46,0,,1,46,,1,"Le nombre de patients qui ont commencé un traitement pour TB-MR, TB pre et TB-UR qui ont fait l'objet d'une surveillance active des effets indésirables n'ont pas été notifiés ",2015,0,133,0,,,133,0,133,0,133,0,133,0,0,0,0,0,0,0,0,0,0,0,0,0,,1,5088,966,621,0,,,,1,,,,Reporting dates were not provided.,,,,,Reporting dates were not provided.,,,,,,,Reporting dates were not provided.,,,,,,,2022-08-26,0,,,,,,,,,0,,,,,,
Switzerland,CH,2021,319,25,11,0,0,0,9,8,355,355,9,364,252,8,67,257,1,220,2,0,2,,,16,20,,36,43,29,20,31,195,0,2,1,0,,,6,10,,45,29,10,26,27,153,0,7,60,243,,,0,,4,1,0,4,0,1,1,1,3,,3,,0,0,,220,7,5,0,,,219,6,16,0,5,0,5,0,4,1,0,0,0,0,1,0,0,0,0,0,,,,,,,,,,1,,,,Reporting dates were not provided.,,,,,Reporting dates were not provided.,,,,,,,Reporting dates were not provided.,,,,,,,2022-08-26,0,,,,,,,,,0,,,,,1,
Côte d'Ivoire,CI,2021,14350,2081,3155,984,95,64,343,,19586,20729,1486,21072,14350,1307,0,,1,221,199,,,417,,,,1967,3274,3539,2201,1175,858,13014,0,189,,,427,,,,1362,1549,1499,901,644,528,6483,0,1232,60,7100,,,1,,507,18,0,447,4,8,1,363,0,,1,353,455,0,,8494,1307,252,255,,,252,255,91,87,252,255,91,87,,,,,,,,,,,,1,,1,20612,2733,2632,,,,,0,,,0,Record removed by UNAIDS,,,,1,,"Registre TARV;
Rapport SIG,
DHIS2
",,,,,0,Record removed by UNAIDS,"DHIS2,
Registre de dispensation des ARV?
Registre de dispensation d
",,,1,,,2022-08-26,0,,,,,,,,,0,,,,,,
Cook Islands,CK,2021,0,0,0,0,0,0,0,,0,0,0,0,0,0,0,0,0,222,,,,,0,,,0,0,0,0,0,0,0,0,,,,,0,,,0,0,0,0,0,0,0,0,0,60,0,,,0,No TB case detected in 2021,0,0,0,0,0,0,0,,0,,0,,0,0,No TB case detected in 2021,0,0,0,0,,,0,0,0,0,0,0,0,0,0,0,0,0,0,0,0,0,0,0,0,0,No TB case detected in 2021,,0,0,0,,,,,0,No new case of TB in 2021,,,Reporting dates were not provided.,,,,,Reporting dates were not provided.,,,,,,,Reporting dates were not provided.,,,,,,,2022-08-26,0,,,,,,,,,1,No survey done in Cook Islands,,,,,
Chile,CL,2021,1843,125,524,115,5,19,96,,2492,2631,235,2727,1843,199,0,683,1,220,21,12,11,,,43,105,,310,267,264,279,307,1575,0,18,10,15,,,37,71,,215,161,125,156,204,969,0,87,60,1714,,,0,,55,5,1,54,0,5,1,55,1,0,1,55,60,0,,1772,179,38,13,,,1772,178,72,14,38,13,22,4,51,5,0,0,0,0,5,0,0,0,0,0,,1,2272,215,202,1,59,0,0,1,,202,0,,,112,3955,0,,,90,3955,125,45947,0,,,36,85,0,,"
No se dispone del detalle respecto de las personas que iniciaron profilaxis el 2020 y que completaron la profilaxis el año 2021 según año de inicio de TAR. Los datos consignados corresponden a la totalidad de personas en TAR (nuevos y antiguos) que iniciaron profilaxis el 2020 y que completaron la profilaxis el año 2021. 
No se dispone de la información por esquema de profilaxis.",2022-08-26,0,,,,,,,,,0,,,,,,
Cameroon,CM,2021,14095,4376,2908,1030,0,0,457,,21379,22409,1487,22866,14095,1487,0,138,1,221,248,,,388,,,,1996,3531,3263,2348,1489,1045,13672,0,244,,,421,,,,1550,1914,1763,1009,707,493,7436,0,1301,60,5150,,,0,"Du fait que les outils moléculaires ne sont pas disponibles sur toute l'étendue du territoire, le 2.11 représente la somme issue des populations prioritaires (enfants de moins de 5 ans, PVVIH et prisonniers) du programme.",137,1,0,107,2,1,1,16,0,,1,16,0,0,La transition au régime court complètement oral a été effective à partir de septembre 2021 dans deux sites (Yaoundé et Douala) de prise en charge sur onze.,5161,1447,56,81,,,15,15,12,13,15,15,12,13,16,0,0,0,0,0,0,0,0,0,0,0,les données concernant la résistance à la rifampicine et à l'isoniazide sont encore partielles.,0,21514,4375,4316,0,,,,0,,,0,Record removed by UNAIDS,,4286,75954,0,,,,,,,0,Record removed by UNAIDS,,,,1,,,2022-08-26,0,,,,,,,,,0,,,,,,
